"E54942014","02","SE","20/08/2014","201403684","18/08/2014 10:08","3","BALESTIER ROAD","BALESTIER ROAD","1","1","1","1","7","33","1","2","5","70","54","0","0","0","N","Y","N","N","Y","NP299","26","R","SBS5216M NO DAMAGE (TPRG) CAM ON BOARD ATTENDED S&S ON SERVICE","My bus was stationary in the middle lane along Balestier Road due to heavy traffic. Suddenly, a white car 's side mirror at lane 3 had brushed the right rear of my bus. The right rear light was slightly damaged but found that it was old injury later and not related to this accident. Could not get the particulars of the car as it did not stop after hitting my bus. No injury. that 's all. /*T/20140818/4045*/ ","","","EDSFOF02","20/08/2014 11:08","EDBDAM04","25/08/2014 10:08","","Y"
"W54612014","02","SW","19/08/2014","201403685","18/08/2014 14:08","2","Lutheren Road T Farrer road","Farrer road","1","1","1","1","3","33","2","3","5","70","51","0","0","0","N","Y","Y","N","N","","26","R","sbs6187G - body near tyre #5 small portion paint scratch w/ advertisement sticker peel off(BMRG) cctv","I was travelling alg Farrer Rd proceeding twds Eunos. I was on the left lane approaching bs41111,8.0km. Reaching said bstop. when passing by Lutheren Road, a car appeared and did not stop at said road stopping line thus its front RHS grazed my bus LHS center. I stopped at bstop. I exchange particulars. I inform OCC. Pax transferred to next bus. Another BC was send to replaced me. I went to WS to report accident. That is all","","Bc reported on 19/08/2014","WDSSOF01","19/08/2014 11:08","EDBDAM04","25/08/2014 10:08","","Y"
"W54502014","02","SW","18/08/2014","201403686","18/08/2014 13:08","1","Bus bay 8.7 KM - Pioneer Stn","Jurong West St 63","1","1","1","1","17","42","3","1","5","70","52","0","0","0","N","Y","N","N","N","","26","R","SBS3146U - Left front v/m no damaged ( BLRG ) Cam Onboard","I was driving my bus along JR West St 63 twds bus bay 8.7 KM. And there was a pte bus PC231U stopping inside said b/bay, on seeing I then swerved in & then stopped my bus at the ingress at bus bay behind said pte bus for paxs activities. Aft paxs activities, I then swerved out to the right & I was checking on my right any oncoming m/vehs, aft when I looked back I saw my bus left front v/m had already collided onto the rear right corner top of said pte bus. I alighted to check, WOCC informed & to cont my svc twds BLI.","","","JRADAA01","18/08/2014 16:08","EDBDAM04","25/08/2014 10:08","","Y"
"W54622014","02","SW","19/08/2014","201403687","18/08/2014 15:08","2","Teban Gardens road","Teban Gardns road","1","1","1","1","2","33","3","2","5","88","54","0","0","0","N","Y","Y","N","N","","26","R","sbs7457X - rear LHS engine cover, body panel damaged(JERG) cctv","At JEI, when I checked bus, I noticed damage to rear LHS. I recalled earlier when I was travelling along Jurong town Hall  Rd. I was turning right into Teban Gardens Rd when my LHS rear grazed a yellow road works machine. Said machine was taking space of about 1 lane. Road space left for bus was very narrow.  However, I was not aware and the construction workers did not approach my bus. That is all","","BC reported on 19/08/2014","WDSSOF01","19/08/2014 11:08","EDBDAM04","25/08/2014 10:08","","Y"
"W55192014","02","SW","21/08/2014","201403689","19/08/2014 23:08","2","bstop near Blk 917","hougang ave 9","2","1","1","1","19","33","3","1","1","86","78","0","0","0","N","Y","Y","N","Y","F/2054","21","R","sbs2734D - SKRG","I was abt to stop at said bstop when I heard a sound from rear. I turned and saw a F/pax fell. I attended to her and asked if she needs AMB. She informed she is fine and does not require AMB. She then mentioned that while holding on the railing when abt to alight, she lost balance and fell. She also mentioned that she do not sustain any injuries. She provided me her particulars. I had lodge police report.","","BC reported on 20/08/2014","WDSSOF01","21/08/2014 10:08","SFALIO05","25/08/2014 10:08","","Y"
"E54712014","02","SE","19/08/2014","201403693","27/06/2014 18:06","2","After Suntec Twr Three","Temasek Blvd","1","1","1","1","7","31","2","3","5","70","54","0","0","0","N","Y","Y","N","N","","21","R","SBS8262J, Left out-swing Exit Door unable to open (PRRG) Cam onboard  Attended S&S","I was negotiating a left turn at roundabout of Temasek Blvd and there was a taxi (SHD1664L) in front of me on extreme left. In the midst of it, the taxi stopped resulted my bus sideswipe with the said taxi. The taxi sustained damaged on right rear. No one was injured. We then exchange our particulars. Pax transferred in view of bus damage. Bus RTD after consulted CRS. Photo taken by AS. That's all.   ","","I was on PM shifts.","AMOPPR10","19/08/2014 14:08","SFALIO05","25/08/2014 11:08","","Y"
"W55102014","02","SW","20/08/2014","201403694","18/08/2014 16:08","2","serangoon gardens way","serangoon garden way","1","1","1","1","5","42","2","2","1","70","54","0","0","0","N","Y","Y","N","N","","26","R","sbs6748M - rear LHs panel damage (SGRG) cctv","I was driving alg S'goon Garden Way twds YCK rd. approaching bs aft Post Office, I noticed a lorry, YL324G stopped at ingress of bus bay. While swerving into said bstop, the rear LHS panel of my bus grazed against the front RHS corner of said lorry. No injuries. That is all.","","BC reported on 20/08/2014","WDSSOF01","20/08/2014 16:08","EDBDAM04","25/08/2014 11:08","","Y"
"E50712014","02","SE","31/07/2014","201403696","27/07/2014 15:07","2","ALEXANDAR ROAD BUS STOP (ANCHOR PT)","ALEXANDAR ROAD","1","1","1","1","2","33","4","2","5","70","54","0","0","0","N","Y","Y","N","N","","21","R","SBS6376C NO DAMAGE (BSRG) CAM ON BOARD  ATTENDED S&S ON SERVICE","There was a taxi (SHC1266H) stopped inside the bus stop 15.8 km (Anchor Point) along Alexander Road. I was moving into the bus stop. In front of my bus, there was another SBS Bus (svc 64) which moved forward a little  to allow me to move into the bus stop. While moving in, my bus side swipe the taxi. No injury. That 's all. ","","","EDSFOF02","31/07/2014 09:07","SFALIO05","25/08/2014 11:08","","Y"
"W55672014","02","SW","25/08/2014","201403705","23/08/2014 10:08","4","B/stop 14.8 KM - Peoples' PK Ctr","Eu Tong Sen St","2","2","1","1","4","42","3","1","5","86","78","1","0","0","N","Y","N","N","Y","J/2089","14","R","SBS3160C - No damaged ( CLRG ) Cam Onboard","I had stopped my bus at the kerbside b/stop along Eu Tong Sen St for paxs activities. Aft paxs activities, I closed both doors & moving off abt 1-2 secs when suddenly I heard sound came from the upp stairwell, I stopped my bus & looked behind & noticed an old lady did not fell down from from stairwell, as 3 persons had already grab onto her from falling. I went to check with her & paxs also assisted to her, behind of her head had swollen & back pain. WOCC informed to activiate amb quickly. Aft being attended to by Paramedic the injury was conveyed to SGH by amb. Then IO & MTI arr.  Tr paxs. I terminated my duty at scene. Later another BC took over my duty, I left.","","","JRADAA01","25/08/2014 11:08","SFALPR04","25/08/2014 14:08","","Y"
"W55632014","02","SW","25/08/2014","201403706","23/08/2014 16:08","2","Bus bay 26.9 KM - Buona Vista Stn","Nth Buona Vista Rd","2","2","1","1","9","42","4","1","5","86","64","1","0","0","N","Y","N","N","Y","D/2073","14","R","SBS2737X - No damaged ( CLRG ) Cam Onboard","My bus was stationary stopped at bus bus bay 26.9 KM along Nth Buona Vista Rd for paxs activities. I then applied handbrake for paxs, a lady pax who was caryying a baby on her arm alighting at the entrance door. Whilst she was alighting, I noticed she slipped on the steps & then she fell off with face facing downwarded. Her husband carried pram was behind her. I quickly alighted to check & I noticed on her right arm, leg suffered abrasions, & the baby she was carrying ther started to cry. The baby is fine. The adult refused medical attention. Informed WOCC to activate an ambulance. Amb, MTI, Police & IO arr. Aft being attended to by Paramedic, both were conveyed to hosp by amb. Paxs all alighted. Aft IO interview I was told to off-svc back to NBVT.","","","JRADAA01","25/08/2014 10:08","SFALPR04","25/08/2014 14:08","","Y"
"W56122014","02","SW","26/08/2014","201403710","08/08/2014 22:08","2","along the way","along the way","2","1","1","1","14","33","2","3","5","86","74","0","0","0","N","Y","Y","N","N","","14","R","sbs3737P - HCRG, cctv","Ref:CFMS2014/aug/1319. I did not encounter pax injured as no one informed. that is all","","bc reported on 25/08/2014","WDSSOF01","26/08/2014 15:08","SFALPR04","27/08/2014 15:08","","Y"
"W56332014","02","SW","27/08/2014","201403717","23/08/2014 08:08","1","Jln boon Lay X Boon Lay Way","Jln boon Lay X Boon Lay Way","1","1","1","1","8","27","2","3","1","70","54","0","0","0","N","Y","Y","N","N","","14","R","sbs8485H - BLRG, cctv","I was driving alg Jln Boon Lay going to turn right into boon Lay Way. I was on the most right lane. There was a SMRT SMB17M, svc 172 on my LHS. At end of junction, I stopped to allow said SMRT bus to turn first. Said bus RHS sideswiped my LHS mirror causing it to bend. Said SMRT bus did not stop and left scene. I procced to the front, stopped, alighted and fixed back mirror. I cont svc. Somewhere along the journey, Int called me to infrom said SMRT bus had report of earlier accident. That is all.","","bc reported on 27/08/2014","WDSSOF01","27/08/2014 11:08","SFALPR04","28/08/2014 10:08","","Y"
"E55762014","02","SE","25/08/2014","201403718","23/08/2014 12:08","1","ALJUNIED ROAD","ALJUNIED ROAD","3","1","1","1","14","33","2","2","5","91","73","0","0","0","N","Y","Y","N","N","","14","R","SBS6600E LEFT MIRROR DROPPED (BDRG) CAM ON BOARD ATTENDED S&S  ON SERVICE","I was filtering from lane 2 into lane 1 along Aljunied Road when my bus the left view mirror hit the corner of the coffee shop canopy. No injury. That 's all.","","","EDSFOF02","25/08/2014 16:08","SFALPR04","28/08/2014 10:08","","Y"
"W56412014","02","SW","27/08/2014","201403735","22/08/2014 09:08","1","sengkang int parking lot","sengkang interchange","3","1","1","1","9","37","1","1","5","91","73","0","0","0","N","Y","Y","N","N","","21","R","sbs6100G - front LHs corner w/screen broken, side panel damged(SKRG) cctv","I was going to berth svc 163 to pick up pax. when making a turn, suddenly I lost control and my bus rammed onto bolard of the svc berth area. I was feeling giddy when said accident took place. I did recall taking meds for high blood and high cholestrol. I also recalled having bfast and I did tripped and almost fall when boarding my bus but I just cont my trip. I wish to declare that I did not consume any irregular medication on said day","","BC reported on 27/08/2014","WDSSOF01","27/08/2014 15:08","SFALIO02","28/08/2014 14:08","","Y"
"W55522014","02","SW","22/08/2014","201403736","19/08/2014 23:08","2","HGBP workshop p/lot","hougang bus park","3","1","1","1","4","39","3","1","5","70","54","0","0","0","N","Y","Y","N","N","","21","R","sbs6399L - NS rear corner panel damged, cctv broken(HCRG) cctv sbs6173X - NS front corner window glass broken","I wanted to park my bus at said p/lot. Accidentally the nearside rear corner of my bus grazed against the offside front corner portion of stationary parked bus while reversing. No injury. that is all","","BC reported on 20082014","WDSSOF01","22/08/2014 16:08","SFALIO02","28/08/2014 14:08","","Y"
"E55722014","02","SE","25/08/2014","201403738","25/08/2014 10:08","3","BEDOK RESERVOIR RD BUS STOP 84469","BEDOK RESERVOIR RD","2","1","1","1","11","42","4","2","5","86","63","0","1","0","N","Y","N","N","Y","NP299","21","R","SBS3410G NO DAMAGE (AMKRG) CAM ON BOARD ATTENDED S&S ON SERVICE","I just made my way out of the bus stop 84469 along Bedok Reservoir Road when I heard someone knocking the front door of my bus. I discovered that one chinese female standing in front of the door. She was trying to board my bus. I applied my brakes and the said  subject lost her balance and fell to the ground. I alighted to assist the fallen passenger , Phua Mei, H/P : 94479039. She told me left side chest and leg pain. I activated the ambulance to convey her to hospital. There were a witness (Fatimah, 87162544). That 's all. /* F/20140825/2081*/","","","EDSFOF02","25/08/2014 14:08","SFALIO02","28/08/2014 15:08","","Y"
"W56012014","02","SW","26/08/2014","201403739","25/08/2014 08:08","3","Bus bay 20.5 KM _ Blk 535","HG Ave 8","2","1","1","1","6","42","4","1","5","86","79","0","0","0","N","Y","N","N","Y","J/2201","21","R","SBS7335P - No damaged ( CLRG ) Cam Onboard","I had stopped my bus at bus bay 25.0 KM along HG Ave 8 for paxs activities. Aft paxs activities, I then moved off & then filtered out from said bus bay when suddenly I heard someone falling sound came onboard my bus. I then stopped my bus at exit of bus bay & then made a check.I saw a f/ch had fallen down & she was seated. Paxs had went to assist her up. She told me that my bus was jerking & told me she had head operation, had high blood, heart attack & she felt giddy too, I asked her whether she need amb. she declined. WOCC informed & took her particulars & then cont my svc twds HG Inter.","","","JRADAA01","26/08/2014 14:08","SFALIO02","28/08/2014 15:08","","Y"
"W55442014","02","SW","22/08/2014","201403740","22/08/2014 08:08","1","Wdlands Interchange","wdlands Interchange","1","1","1","1","7","37","2","1","5","70","52","0","0","0","N","Y","Y","N","N","","21","R","sbs3719S - nearside front v/mirror dropped(HCRG) cctv","I was driving along Wdlands Int twds boarding berth. My bus aws following behind TIB1226S before turn left. I looked backwards to the left to check before turning left. suddenly I discovered that said bus had stop. On seeing this, I applied brake to stop but it was too late. the nearside front v/mirror of my bus hit the rear nearside w/screen of said TIB bus. I called OCC. No injury. That is all","","BC reported on 22/08/2014","WDSSOF01","22/08/2014 14:08","SFALIO02","28/08/2014 15:08","","Y"
"W56452014","02","SW","27/08/2014","201403741","22/08/2014 21:08","2","blk 112 bs, rivervale drive","rivervale drive","2","2","1","1","12","42","3","1","1","86","78","0","1","0","N","Y","Y","N","Y","F/2005","21","R","sbs3393Y - SKRG(cctv)","I was approaching said bstop for pax act, I applied brake and stopped when a M/pax fell as he did not hold onto the railing. I made a check on him and he mentioned that back of his head in pain. I activate AMB. Said pax convyed to CGH. I informed OCC.","","bc reported on 26/08/2014","WDSSOF01","27/08/2014 16:08","SFALIO02","28/08/2014 15:08","","Y"
"W56302014","02","SW","27/08/2014","201403742","22/08/2014 20:08","2","Hougang ave 6, bs43.6km","hougang ave 6","2","1","1","1","11","42","2","3","5","86","65","0","0","0","N","Y","Y","N","N","","21","R","sbs6091Z - HCRG, cctv","I stopped at said bs and opened the exit door for alighting. when the exit door was activated to open, suddenly I heard sound from the rear. Immediately I checked and discovered that a F/Indian pax abt 60Y left finger was trapped btwn the pole and exit door. I tried to close back the exit door but could not. I then alighted and tried to force close the exit door to release said pax hand. I checked with her if she is injured. She refused saying she is alright. I called OCC. She then alighted at the bstop. no visible injury. that is all","","bc reported on 26/08/2014","WDSSOF01","27/08/2014 09:08","SFALIO02","28/08/2014 15:08","","Y"
"W55752014","02","SW","25/08/2014","201403743","22/08/2014 09:08","1","Prinsep st X middle rd","Prinsep st X middle rd","1","1","1","1","9","28","2","3","1","70","54","0","0","0","N","Y","Y","N","N","","21","R","sbs3000G - front OS body panel cracked(HCRG) cctv","I was driving alg the 1st left lane of Prinsep St heading twds Sgoon Rd. On reaching said junctn, t/light is green but suddenly a lorry, GZ8773E swerved into my path from the right lane. I stopped but it was too late. As a result, the said lorry NS rear grazed against the front OS of my bus. I called OCC to report. Said driver refused to exchange particulars. As it was minor damage, I was instructed to cont svc. no injury. That is all","","BC reported on 22/08/2014","WDSSOF01","25/08/2014 16:08","SFALIO02","28/08/2014 15:08","","Y"
"W55702014","02","SW","25/08/2014","201403744","22/08/2014 10:08","1","Inter Alighting Berth","Toa Payoh Interchange","2","2","1","1","11","37","3","1","5","86","78","1","0","0","N","Y","N","N","Y","J/2210","21","R","SBS3122M - No damaged ( BLRG ) Cam Onboard","My bus had stopped stationary at the TP Inter alighting berth for alighting paxs activities.I then opened both doors for alighting paxs activities when suddenly I heard sound came from the stairwell & then I noticed a lady pax had fallen down. I then checked with the lady & she claimed that her left arm had redness, I asked her whether she need medical attention, she declined. then she alighted from the bus. Aft lighting paxs activities, I then went for parking. When I walked to POS & I saw subject was inside POS. ARM on my behalf informed WOCC, amb was activiated & I was told to wait. Aft being attended to by Paramedic the injury was conveyed to hosp. by ambulance. ( Later I was told halfway on svc to BLI)","","","JRADAA01","25/08/2014 13:08","SFALIO02","28/08/2014 15:08","","Y"
"E56432014","02","SE","27/08/2014","201403746","25/08/2014 12:08","1","KIM SENG ROAD","KIM SENG ROAD","1","1","1","1","13","20","2","1","5","70","54","0","0","0","N","Y","Y","N","N","","21","R","SBS9838S RIGHT SIDE REAR BODY DAMAGED (PRRG) NO CAM ATTENDED S&S ON SERVICE ","I was driving along Kim Seng Road making a left bend when a Taxi (SHA4026A) side swipe my bus. As I was driving through this left bend everyday, quite familiar with it. Vehicles need to slow down but the Taxi was likely moving at a fast speed.The Taxi driver refused to exchange particulars. No injury. That ' s all.","","","EDSFOF02","27/08/2014 15:08","SFALIO02","28/08/2014 15:08","","Y"
"W55962014","02","SW","26/08/2014","201403749","22/08/2014 16:08","2","Bus Bay 5.2 KM","West Coast Road","2","2","1","1","2","42","4","1","5","86","74","0","1","0","N","Y","N","N","N","","21","R","SBS5019R - No damaged ( JERG ) Cam Onboard","I had stopped my bus at bus bay West Coast Rd to pick-up 1 pax.  The pax f/ch then boarded my bus, when boarding I saw both of her hands were carrying 2 plastic bags. I waited & seeing she had walked to the rear & she had put 1 of plastic bag at compartment, I checked on my right, it was clear & I thought pax had already seated, I moved off & then filtered to right & when I heard sound ' aaaa' I stopped my bus & went to check, I turned my head & saw she was squatting down beside the 1st seat & my witness had went to assist her up, I checked with her anything happened to her, she claimed her right arm slight pain, WOCC informed & I was told to check with her whether she need amb, she declined amb offer & would liked to consult doctor on her own.","","","JRADAA01","26/08/2014 11:08","SFALIO02","28/08/2014 16:08","","Y"
"E55782014","02","SE","25/08/2014","201403750","25/08/2014 13:08","1","KALLANG WAY BUS STOP 10.2 KM","KALLANG WAY","1","1","3","2","17","42","4","2","5","70","60","0","0","0","N","Y","Y","N","N","NP299","21","R","SBS5080L REAR RIGHT SIDE BUMPER DAMAGE (EURG) CAM ON BOARD ATTENDED S&S  ON SERVICE","As I was driving along Kallang Way when I heard some noise from the rear of my bus. I turned around and saw a motor-car in black drove passed my bus. Upon checking on the side mirror, discovered that a part of my bus 's rear bumper was damaged. I stopped to assess the damage. The back portion was badly damaged and I believed another vehicle might had crashed onto my bus. However, I could not confirmed if the car that drove past me was the culprit. Weather was bad. No injury. that 's all. ","","","EDSFOF02","25/08/2014 16:08","SFALIO02","28/08/2014 16:08","","Y"
"W55912014","02","SW","26/08/2014","201403764","22/08/2014 15:08","1","upp sgoon rd","upp sgoon road","1","1","1","1","19","33","3","3","5","70","54","0","0","0","N","Y","Y","N","N","","21","R","sbs2610C - rear OS corner body panel and bumper scratched(HCRG) no cctv","I was heading twds HG ave 2. at that time, there was road works in progress on the extreme left. On reaching t/light signal for ped. crossing, t/light turned red. i slowed down and stopped. when it turned green, as i was abt to move off, i noticed a red taxi flash his headlight. i then swerved to the left and stopped to check. i alighted and discovered that said taxi,SHD5051D front NS was dented and my bus offside corner body and bumper scratched. No injury. that is all","","bc reported on 25/08/2014","WDSSOF01","26/08/2014 09:08","SFALIO02","01/09/2014 08:09","","Y"
"E56712014","02","SE","29/08/2014","201403768","22/08/2014 10:08","1","LORONG 1 GEYLANG & SIM AVE TRAFFIC JUNC","LORONG 1 GEYLANG & SIMS AVE JU","1","1","1","1","10","27","3","1","5","70","54","0","0","0","N","Y","Y","N","Y","","21","R","SBS6642J RIGHT SIDE FRONT WINDOW GLASS BROKEN (PRRG) CAM ON BOARD ATTENDED S&S ON SERVICE","I stopped at a traffic junction along Lorong 1 Geylang wanting to turn left into  Sims Ave. On my right side, there was a lorry (XB3106P). When the traffic light turned green, both of our vehicles proceed to turn left. When I saw the lorry very close to my bus, I stopped. The lorry continue to move and side swipe my bus. It hit my bus. No injury. That's all. ","","I worked AM shifts finished at about 1600 hrs +.","EDSFOF02","29/08/2014 10:08","SFALIO02","01/09/2014 08:09","","Y"
"E55882014","02","SE","26/08/2014","201403770","25/08/2014 08:08","1","SIGLAP DRIVE BUS STOP","SIGLAP DRIVE","1","1","1","1","6","42","2","2","5","70","53","0","0","0","N","Y","Y","N","N","","21","R","SBS6456E RIGHT SIDE PORTION (BDRG) CAM ON BOARD ATTENDED S&S ON SERVICE","During incident period, my bus was stationary at the bus stop for passenger activity when 3P, who was travelling on the opposite direction, sideswipe my bus when it was turning left into siglap plain. 3P admitted his fault and I referred him to contact our RG office. No injury. That 's all. ","","","EDSFOF02","26/08/2014 08:08","SFALIO02","01/09/2014 08:09","","Y"
"E55952014","02","SE","26/08/2014","201403772","25/08/2014 14:08","3","BEDOK NORTH ST 3","BEDOK NORTH ST 3","1","1","3","2","5","33","2","2","5","85","58","0","0","0","N","Y","Y","N","N","","21","R","SBS9812R EXIT DOOR GLASS BROKEN (BDRG) NO CAM ATTENDED S&S ON SERVICE","I was driving out of a bus stop 2.3 km, opposite blk 546 along Bedok North street 3. The traffic light in front was red, hence, I stopped my bus. In front of my bus, there were other vehicles.  I heard some sounds. I turned my head to check, nothing happened inside the bus. i continued to drive. After I arrived at the Bedok Int., alighted all passengers and drove to the parking lot. After parking, I made a check and discovered one side of the exit door glass was broken. I reported to Route M.aster. After that, send the bus to Bedok Depot. Drove another bus the same route and discovered that there was broken glass pcs at the spot where I heard the sound. No injury. That 's all.","","","EDSFOF02","26/08/2014 11:08","SFALIO02","01/09/2014 09:09","","Y"
"E56132014","02","SE","26/08/2014","201403780","18/08/2014 07:08","1","LOR. 8 & 7 TOA PAYOH T JUNCTION","LOR. 8 & 7 TOA PAYOH TJUNCTION","2","1","1","1","5","26","1","1","5","86","74","0","1","0","N","Y","N","N","Y","NP299","23","R","SBS6319T NO DAMAGED (TPRG) CAM ON BOARD ATTENDED S&S ON SERVICE","I turned left from Lor. 8 into Lor. 7 Toa payoh. When I applied brakes, I realised that the bus braking system was a little off. I had no choice as there was a car in front of me. I checked that all my  passenger was fine. At 0800 hrs, I was at the Toa Payoh Int. 2 ladies aproached me and informed that one of them was injured. The Lady that was injured was 59 yrs old. She informed that she hurt herself by hitting her leg against the pole. She told me that it was not my fault. The lady was not speific on how it happen. I directed them to the customer service. That 's all. /*E/20140819/2052*/","","I worked AM shifts","EDSFOF02","26/08/2014 16:08","SFALIO04","01/09/2014 14:09","","Y"
"E55272014","02","SE","21/08/2014","201403802","21/08/2014 12:08","2","Bef Opp. Farrer Park Stn","Rece Course Rd","1","1","1","1","14","27","2","3","1","70","60","0","0","0","N","Y","Y","N","N","","26","R","SBS6392E, Rear portion damaged (TPRG) Cam onboard  Attended S&S","During incident period, I stopped my bus to comply with the red traffic light when I heard a sound discovered that my bus was being hit by a m/van (GW4416D) resulted some damaged on my bus rear portion. The said van sustained damaged on front portion. No one was injured. 3P admitted is his fault and willing to compensate our company. Bus resumed service after exchanging particulars with 3rd party. That's all.","","","AMOPPR10","21/08/2014 16:08","EDBDAM04","02/09/2014 16:09","","Y"
"W57312014","02","SW","02/09/2014","201403816","29/08/2014 17:08","2","c'wealth ave west","c'wealth ave west","1","1","1","1","6","33","2","3","5","70","54","0","0","0","N","Y","Y","N","N","","26","R","sbs8446X - OS front mudguard dented(HCRG) cctv","I was driving alg c'wealth ave west twds c'wealth ave when suddenly a car, SJL2331A encroached into my lane. Its nearside front hit onto the offside front of my bus. i called occ. said car driver admitted fault and wanted to settle. aft exchange particulars, i was instructed to cont svc as minor damage. no injury. that is all","","bc reportedd on 01/09/2014","WDSSOF01","02/09/2014 09:09","EDBDAM04","04/09/2014 08:09","","Y"
