"W58322014","02","SW","05/09/2014","201403987","02/09/2014 17:09","2","KRT parking lot","kent ridge term","3","1","1","1","5","38","4","1","5","70","67","0","0","0","N","Y","Y","N","N","","26","R","sbs8590L-NS rear corner panel scratches(HCRG)  sbs6769C-damage unknown, svc 33, sbs6769C","aft reversing out from parking lot, I was not aware that the rear portion of my bus ahd hit against a stationary parked SBS6769C. I was informed alter by OCC. At that time, I was already travelling alg Clementi Rd near to SIM twds Dunearn Rd. I stopped outside SIM bstop to check my bus. no injurie. that is all","","bc reported on 03/09/2014","WDSSOF01","05/09/2014 15:09","EDBDAM04","12/09/2014 11:09","","Y"
"E57502014","02","SE","03/09/2014","201403989","02/09/2014 17:09","2","TAMPINES INT.","TAMPINES INT.","3","1","1","1","7","37","4","1","5","70","67","0","0","0","N","Y","Y","N","N","","26","R","SBS8231Z REAR DAMAGED (BDRG) CAM ON BOARD ATTENDED S&S ON SERVICE","I was reversing in Tampines Int. when my bus hit another stationary unattended bus (SBS8517A). No injury. That 's all. ","","","EDSFOF02","03/09/2014 11:09","EDBDAM04","12/09/2014 11:09","","Y"
"W59432014","02","SW","11/09/2014","201403992","11/09/2014 07:09","1","seah im road T T.blangah rd","seah im road T T.blangah rd","1","1","1","1","4","25","3","2","1","70","54","0","0","0","N","Y","Y","N","N","","26","R","sbs5231T - r/mirror glass crack (BMRG) cctv","I was driving at Seah Im road wanting to turn left to Telok Blangah road. Infront me were 02 cars. Once t/light showed green left arrow, front cars turned. I too followed. Somewhere pass the stop line a bus, PA5705Y was also turning left from the right lane. I noticed said bus was near to me so I horned but then its LHS hit my r/mirror. I stopped and wanted alight. Said bus moved on and slowed down. I managed to jot down said bus reg no. I then meet him at the bsop and exchange particulars. I inform OCC. CRS attended. CRS towed bus back. I followed too back to BB. that is all","","bc reported on 11/09/2014","WDSSOF01","11/09/2014 16:09","EDBDAM04","12/09/2014 11:09","","Y"
"E58682014","02","SE","08/09/2014","201403997","06/09/2014 10:09","1","Bef Blk 195 b/stop","Jalan Toa Payoh","1","2","1","1","12","33","2","3","5","86","61","","","0","N","Y","Y","N","Y","NP168","26","R","SBS2758K, Front right headlight damaged (TMRG) Cma onboard  Attended S&S on","I was traveling at the said rd when there is a red car ahead of me makes a E-brake and I tried to apply my brake however could not managed to brake in time and thus I hit onto the car. I went down and make a check discover taht my bus front right headlight was damaged. I then tried to tell the 3P to wait for a while as I saw one of my Indian female pax in her 59 years old injured on the head due to my braking. As the 3P could not wait for me, he just left the scene. EOCC was informed and ambulance activated to the scene. She then conveyed to hospital. There was pax onboard willing to be my witness for the said accident. I am lodging this report for record purpose. That's all.   *NP168 T/20140906/4106- Tampines NPC*","","","AMOPPR10","08/09/2014 15:09","EDBDAM04","12/09/2014 11:09","","Y"
"W59392014","02","SW","11/09/2014","201404001","10/09/2014 18:09","2","Pioneer Rd(round about)Jln Ahmad Irahim","Pioneer Rd (Roundabout)","1","1","1","1","7","31","2","1","5","70","54","0","0","0","N","Y","Y","N","N","","26","R","SBS9588M    Front RHS bumper scratches               (BLRG) Cam Onboard","On 10/09/2014 at about 18:45 hrs, I was driving from Pioneer Road at roundabout towards Jalan Ahmad Ibrahim. At this juncture, a taxi on my right was heading to Pioneer Rd North attempted to overtake my bus and hence grazed onto my bus RHS front bumper. I then stopped my bus and went to down to checked and found my bus RHS front bumper corner sustained scratches and third party bearing veh no SHD2669S sustained LHS rear lower panel dented and wheel cover dropped. The driver name is Tan Thod Huat NRIC S1146696F. No injury reported. WOCC informed and instructed me to continue for my service. That is all.","","","WDBLRS04","11/09/2014 14:09","EDBDAM04","12/09/2014 11:09","","Y"
"W58922014","02","SW","09/09/2014","201404006","06/09/2014 21:09","2","Junct Henderson Rd","Bukit Merah Ctrl","1","1","1","1","12","25","3","2","1","70","59","0","0","0","N","Y","N","N","N","","26","R","SBS6145C - Front right headlight cover & corner panel damaged ( BMRG ) Cam Onboard","I had stopped my bus behind a SMRT Bendy bus ( TIB1071X ) of svc 176 at the 1st right outer lane Bt Merah Ctrl comply to traffic red light at junct Henderson Rd. And whilst awaiting, suddenly I saw said SMRT rolled astern, on seeing I horned to alert but failed to stop, as a result said SMRT bus had its rear right portion collided into the front right portion of my bus. Aft accident, said SMRT failed to stop to check & when green light on, said SMRT bus sped off & turned right dir to Henderson Rd, I followed & chased aft & I quickly jot down reg no. WOCC informed, tr paxs & i was told to RTD to BBBP.","","","JRADAA01","09/09/2014 11:09","EDBDAM04","12/09/2014 12:09","","Y"
"W59812014","02","SW","12/09/2014","201404015","11/09/2014 09:09","1","B/stop 8.0 KM - Delfi Orchard","Orchard Road","1","1","1","2","8","32","2","1","5","70","54","0","0","0","N","Y","N","N","Y","T/4093","14","R","SBS6045H - Rear right corner paint scratched ( BMRG ) Cam Onboard","My bus was stationary behind a SMRT bus at the b/stop 8.0 KM along Orchard Rd for paxs activities. And while waiting for the SMRT bus to move off from my right front v/m & I noticed a white m/car ( SFQ1724X ) came from the behind of my bus, overtook to the right & whilst overtaking my bus suddenly I felted jerking came from the rear of my bus. I then saw said car did not stop & sped away. I quickly jotted down reg no. I alighted to check. WOCC informed & cont my svc.","","","JRADAA01","12/09/2014 16:09","SFALPR04","13/09/2014 09:09","","Y"
"E59702014","02","SE","12/09/2014","201404022","17/08/2014 12:08","1","MARINE CRESENT","MARINE CRESENT","1","1","1","1","13","33","4","2","5","85","73","0","0","0","N","Y","N","N","N","","23","R","SBS8250T NO DAMAGED (YCKRG) CAM ON BOARD ATTENDED S&S  ON SERVICE","I was driving along marine cresent when my bus hit a supermarket trolley placed on the road. The owner was a couple, standing on the kerb likely waiting for taxi or transport. No exchange of particulars. No injury. That 's all. ","","I was informed on 11/09/2014 of this complaint.","EDSFOF02","12/09/2014 14:09","SFALIO04","15/09/2014 08:09","","Y"
"W59832014","02","SW","12/09/2014","201404023","28/08/2014 14:08","1","Jurong West Ave 1, Blk 463","Jurong West Ave1","2","1","1","1","19","42","2","2","5","85","82","","","","N","Y","N","N","N","","23","R","SBS 7501B   Bus no damage.  Pax hit by entrance door   (BLRG) Cam Onboard CFMS 2014/Aug/3852","On 28/08/2014 at about 14:40 hrs I stopped my bus at Jr West Ave 1 bus stop code 28511 for paxs activities.After paxs alighting activities,I closed the exit doors and the entrance remained opened as boarding activities is still going on. While all paxs have boarded I saw a chinese lady pax rushing to my bus entrance door. After she got inside my bus then I closed the entrance doors. Suddenly she yelled at me so I immediately opened the doors. I said to pax 'I thought you have already come inside, Sorry.  Are you hurt?' She then say loudly to me that of course she is hurt. I told her 'Sorry' again. She reacted angrily that I did not apologise and told me that she got the bus no and wanted to complain me. I did not show anger to her and seeing her without any injury, I continue my service.","","My ARM-Wong Kee Yeow informed me about this CFMS feedback on 11/09/2014","WDBLRS04","12/09/2014 17:09","SFALIO04","15/09/2014 08:09","","Y"
"E59692014","02","SE","12/09/2014","201404024","05/09/2014 09:09","1","UPPER PAYA LEBAR ROAD","UPPER PAYA LEBAR","1","1","1","1","13","33","1","1","5","70","54","0","0","0","N","Y","Y","N","N","","23","R","SBS9422H LEFT SIDE MIRROR DROPPED (TMRG) NO CAM ATTENDED S&S ON SERVICE","I was driving along upper paya lebar road. Traffic was heavy. My bus side swipe another lorry. I gave my particulars to the lorry driver. As passengers hurried me, no time to take the lorry driver 's particulars. No injury. That 's all.  ","","Personal problem ","EDSFOF02","12/09/2014 14:09","SFALIO04","15/09/2014 08:09","","Y"
"E59722014","02","SE","12/09/2014","201404026","08/09/2014 11:09","3","BRAS BASAH ROAD x JUNCTION","BRAS BASAH ROAD","3","1","1","1","9","27","2","1","5","70","60","0","1","0","N","Y","Y","N","Y","NP299","23","R","SBS6653C REAR DAMAGE (YCKRG) CAM ON BOARD ATTENDED S&S ON SERVICE","My bus stopped at a traffic junction along Bras Basah Road when another bus (SBS9441C, Svc 14) hit my rear. No injury on my bus but there was one injured on SBS9441C. The injured was bleeding from the nose. I did not know the extent of the passenger injury. That 's all.","","I worked split shift","EDSFOF02","12/09/2014 14:09","SFALIO04","15/09/2014 10:09","","Y"
"W58972014","02","SW","09/09/2014","201404026","08/09/2014 11:09","1","junct Waterloo St","Bras Baseh Rd","1","2","1","1","14","25","3","1","1","70","52","0","1","0","N","Y","N","N","Y","D/2085","23","R","SBS9441C - Front w/screen & bumper damaged ( CLRG ) No Cam SBS6653C - Rear w/screen & bumper damaged","Aft paxs activities at b/stop 14.6 KM along Bras Basah Rd, I crossed the t/light & I was negotiating at a right bend turn & was going to straightened my bus, aft straightened my bus I was at the 1st left lane when I saw infront me bus SBS6653C svc 162 was stopping at junct of Waterloo St. On seeing I applied brake to stop but could not stop as a result my bus front portion collided into the rear portion of said bus. I checked with my pax, nobody claimed injured. WOCC informed then I alighted to check. Aft checking, returned to my bus, my pax m/ch approached me & informed me his back was pain but declined medical treatment when I asked him. He told me he was seated. Tr paxs, wait for tow truck. MTI, IO arr. Aft IO had interview, tow truck then tow my bus back to BBBP.","","","JRADAA01","09/09/2014 13:09","SFALIO04","15/09/2014 10:09","","Y"
"W57432014","02","SW","02/09/2014","201404062","01/09/2014 16:09","2","Driveway","Boon Lay Interchange","1","1","1","1","1","37","3","1","5","70","67","0","0","0","N","Y","N","N","N","","23","R","SBS7612P - Left rear corner engine cover scratched ( BLRG )  Cam Onboard","I was stopping my bus behind bus at the BLI driveway awaiting for red light to change green. When suddenly I heard sound came from the left rear portion of my bus. I alighted to check & saw a s/d bus SBS8955T of svc 079 was reversing out at the end-on-berth had its rear right bumper collided into the left rear engine cover of my bus. ARM Naren informed & I was told to cont mys vc.","","","JRADAA01","02/09/2014 14:09","SFALIO04","17/09/2014 09:09","","Y"
"W60082014","02","SW","15/09/2014","201404062","01/09/2014 16:09","2","End-On-berth parking lot","Boon Lay Interchange","1","1","1","1","4","37","4","1","5","70","67","0","0","0","N","Y","N","N","N","","23","R","SBS8955T - Rear right bumper cracked ( JERG ) Cam Onboard SBS7612P - Left rear damaged unknown","My bus was at BLI end-on-berth parking lot. Aft I had pick-up paxs at the parking lot, I then reversed my bus & did not noticed behind at the driveway there was stopping bus, until I heard sound came from rear right of my bus. I stopped & alighted to check & saw the rear right bumper had collided onto the left rear portion of stopping DD bus of svc 030 (SBS7612P) . I then cont my svc at there were paxs onboard my bus. At JEI I reported to Master You How.","","BC claimed he had no time to file TAC. I had informed Master You How on 01092014","JRADAA01","15/09/2014 15:09","SFALIO04","17/09/2014 09:09","","Y"
"W60332014","02","SW","16/09/2014","201404063","02/09/2014 07:09","3","blk 232 HG ave 1","HG ave 1","2","1","1","1","2","33","2","1","1","86","78","0","0","0","N","Y","Y","N","Y","f/2061","23","R","sbs9680D - SKRG, no cctv","ref CFMS/2014/Sep/0162, I was moving alg Lor Ah Soo moving ogg from bstop when suddenly the bus bell was pressed. I looked at the rear v/mirror and saw a F/Chinese pax abt 40Y wanted ato alight. At this moment, I noticed a car stopped infront of my bus near the bstop. As such I applied brakes and the said F/pax fell landing on her bottom. I got off from my seat and approached, assisting her. she insisted she wasnt injured and does not need med. attn. She did not provide her particulars and she alighted shortly after. I observed that she does not have any visible injuries. I had lodge police report.","","bc reported on 12/09/2014","WDSSOF01","16/09/2014 16:09","SFALIO04","17/09/2014 09:09","","Y"
"W60242014","02","SW","16/09/2014","201404064","12/09/2014 10:09","3","Level 3 parking lot","Soon Lee Bus Park","3","1","1","1","12","39","4","1","5","91","73","0","0","0","N","Y","N","N","N","","23","R","SBS2989K - Rear left signal, bumper & body pulled out & damaged ( BLRG )   No Cam","I had parked my bus at the SLBP level 3 parking lot. Infront of my bus there was a DD bus. Aft alighting from my bus & think that if later behind my bus parked another & I could not move off, & due to this reason I decided to shift my bus to another parking lot. I boarded my bus, started bus engine & then reversed my bus. aft reversing I then filtered my bus to the right to overtake infront DD bus in doing so when I heard sound came from the rear left of my bus. I stopped & alighted to check. And I saw the rear left portion of my bus had grazed against the protector railing of pillar.","","","JRADAA01","16/09/2014 13:09","SFALIO04","17/09/2014 09:09","","N"
"W60122014","02","SW","15/09/2014","201404065","12/09/2014 12:09","1","amber road roundabout","amber road","1","1","1","1","13","31","2","1","5","70","54","0","0","0","N","Y","Y","N","Y","","23","R","sbs7387P - L/mirror dropped, CLRG, cctv","I was on the inner lane negotiating roundabt at Amber Rd. Road was narrow. there was a van,YM3837T parked on the outer left lane. While turning, my L/mirror grazed rear of said van. I stopped at the bs afta the roundabout. Van was unattended w/o driver. I inform OCC.Pax transferred. CRS activated. CRS escort me bus abck to BB. That is all","","bc reported on 15/09/2014","WDSSOF01","15/09/2014 16:09","SFALIO04","17/09/2014 09:09","","Y"
"W60022014","02","SW","15/09/2014","201404067","12/09/2014 17:09","2","Junct Dover Rd & Ayer Rajah Ave","Nth Buona Vista Rd","1","1","1","1","6","27","3","3","1","70","67","0","0","0","N","Y","N","N","N","","23","R","SBS5131ZE - Rear bumper paint scratched ( CLRG ) Cam Onboard","I was driving my bus at the 1st left lane Nth Buona Vista Rd heading to infront t/light junct of Dover Rd. Said junct showed green light when I was approaching said junct green light had turned into amber light, I then stopped my bus but my had stopped at the ped junct. When I saw ped was crossing at junct, I decided to reverse my bus but at that moment I did not noticed there was a m/car behind behind, I then reversed until I heard horning sound came from the rear of my bus. I stopped & alighted to check & saw a yellow colour m/car SGS7919X, the m/car driver a male malay pointed to me his car front bumper paint scratched. We exchange particular, I only jotted down his contact number, & then left the scene.","","","JRADAA01","15/09/2014 12:09","SFALIO04","17/09/2014 09:09","","Y"
"W59612014","02","SW","12/09/2014","201404071","06/09/2014 09:09","1","Sgoon Ave 2 slip Boundary rd","boundary road","1","1","1","1","9","27","2","3","1","70","54","0","0","0","N","Y","Y","N","N","","26","R","sbs8143U - SKRG, cctv","I was driving alg Boundary Rd on the left most lane. aft passing thru said t/light, I notice a lorry,GY8814B on the LHS in stationary alg S'goon Ave 2 at the filter lane. I assume said lorry is giving way to me. Aft passing by said lorry, I heard a sound from rear door. I looked at l/mirror and saw said lorry had hit my rear door. I stopped alg Boundary Rd. No injuries to both parties.","","bc reported on 11/09/2014","WDSSOF01","12/09/2014 10:09","EDBDAM04","17/09/2014 10:09","","Y"
"E55472014","02","SE","22/08/2014","201404073","18/08/2014 16:08","2","Alighting berth","Ang Mo Kio Bus Interchange","2","1","1","1","6","37","2","1","5","70","54","0","0","0","N","Y","Y","N","N","","26","R","SBS8167B, Left v/mirror dislodged (YCKRG) Cam onboard  ","After alighted my pax at the alighting berth, I intend to swerve my bus out when my bus sideswipe with a front bus (SBS5038K, svc 261) resulted my bus left v/mirror bracket dropped. Svc 265 awaits CRS due to left mirror damaged. My bus was escorted back by CRS. Photo taken by AS. That's all.","","Was on PM shifts.","AMOPPR10","22/08/2014 15:08","EDBDAM04","17/09/2014 10:09","","Y"
"E59762014","02","SE","12/09/2014","201404073","18/08/2014 16:08","2","ANG MO KIO INT. ALIGHTING BERTH","ANG MO KIO INTERCHANGE","3","1","1","1","4","37","4","1","5","70","60","0","0","0","N","Y","Y","N","N","","26","R","SBS5038K REAR SIGNAL LIGHT COVER BROKEN (AMKRG) CAM ON BOARD ATTENDED S&S ON SERVICE","I stopped at AMK alighting berth for pax activities. Another bus (SBS8167B) hit my rear while overtaking. No injury. that 's all.","","I forget.","EDSFOF02","12/09/2014 15:09","EDBDAM04","17/09/2014 10:09","","Y"
"E58892014","02","SE","09/09/2014","201404098","08/09/2014 16:09","2","YISHUN INT.","YISHUN INT.","3","1","1","1","3","37","4","1","5","70","67","0","0","0","N","Y","Y","N","N","","23","R","SBS6602A RIGHT SIDE WINDOW GLASS CRACKED (TMRG) CAM ON BOARD ATTENDED S&S ON SERVICE","I stopped at the drive way waiting for parking lot in Yishun Int.  Another bus(SBS8328D Svc 039) hit my bus while reversing out from a parking lot. No injury. That 's all. ","","","EDSFOF02","09/09/2014 10:09","SFALIO04","18/09/2014 16:09","","Y"
"E60542014","02","SE","17/09/2014","201404098","08/09/2014 15:09","3","Svc berth","Yishun Bus Interchange","3","1","1","1","1","37","2","1","5","70","67","0","0","0","N","Y","Y","N","N","","23","R","SBS8328D, Rear w/screen damaged (TMRG) Cam onboard  ","I intend to reversed my bus out from the svc berth after pax boarded my bus when I heard a sound discovered that my bus had collided with a stationary bus (SBS6602A, svc 39) which no BC attach to the bus. My bus sustained damaged on rear w/screen and the said bus sustained damaged on right front. EOCC was informed and was told by them returned my bus to depot. That's all.","","Was on duty.","AMOPPR10","17/09/2014 13:09","SFALIO04","18/09/2014 16:09","","Y"
"E60532014","02","SE","17/09/2014","201404099","12/09/2014 16:09","3","LENG KEE ROAD 15.7 KM","LENG KEE ROAD","1","1","1","1","1","33","4","2","5","70","53","0","0","0","N","Y","Y","N","N","","23","R","SBS9847R RIGHT SIDE REAR SCRATCHES(TPRG) CAM ON INSIDE ONLY ATTENDED S&S ON SERVICE","I was driving along Leng Keng Road. On my right side There was a car (SCG363E) going against the traffic direction. After the car driver realised the mistake, he became like panicky and reversed his car and hit the right side rear of my bus. The driver apologised. We exchange particulars. No injury. That 's all. ","","","EDSFOF02","17/09/2014 13:09","SFALIO04","18/09/2014 16:09","","Y"
"W60722014","02","SW","18/09/2014","201404103","17/09/2014 10:09","1","Driveway","Kent Ridge Terminal","1","1","1","1","10","38","3","1","3","70","60","0","0","0","N","Y","N","N","N","","23","R","SBS8057K - Rear right signal & body cracked ( CLRG )  Cam Onboard","Aft alighting paxs at Kent Ridge Term, I was driving my bus along the driveway, I then stopped my bus on the left along the driveway at the stop line, I alighted from my bus & wanted to report to ARM. Aft alighting & was on the way to the POS, when I heard sound 'bang ' , I looked back & saw a yellow bus had collided into the rear of my bus. I walked back to my bus & saw pte bus PC159X front portion had collided into the rear portion of my bus. The driver told me his bus had no brake. ARM Abdul Shukur took photo & then asked me to cont svc.","","","JRADAA01","18/09/2014 12:09","SFALIO04","18/09/2014 16:09","","Y"
"E60712014","02","SE","18/09/2014","201404104","17/09/2014 16:09","3","CHURCH ST"," CHURCH ST","1","1","1","1","3","21","1","1","5","70","54","0","0","0","N","Y","Y","N","N","","23","R","SBS933J LEFT SIDE BODY DAMAGE(YCKRG) CAM ON INSIDE ONLY ATTENDED S&S ON SERVICE","I was driving along Church Street. There was a car (SJY6959U) on my left side driving too close to my bus. It side swipe my bus. We exchange particulars. No injury. that 's all.","","","EDSFOF02","18/09/2014 11:09","SFALIO04","18/09/2014 16:09","","Y"
"E58702014","02","SE","08/09/2014","201404115","06/09/2014 17:09","2","TAMPINES AVE 5","TAMPINES AVE 5","2","1","1","1","5","33","1","2","5","86","78","0","0","0","N","Y","N","N","Y","NP299","26","R","SBS7421Z NO DAMAGE (YCKRG) CAM ON BOARD ATTENDED S&S  ON SERVICE","While driving along Tampines Ave 5 after 2nd bus stop, a passenger Thio Chew Peng Joyce,S6935356H, DOB : 15/10/1969,BLK 91 Lorong 3 Toa Payoh singapore 310091 who was initially standing near to the driver seat suddenly fell in the bus. The bus was crowded and mvoing at a slow speed. I and another nurse immediately rendered assistance. The passenger informed that she had not eaten for 2 days that cause her dizzy. She mentioned that ever fell  down in MRT. Ambulance was activated to convey her to hospital . That 's all. /*F/20140907/2010*/","","","EDSFOF02","08/09/2014 15:09","EDBDAM04","22/09/2014 08:09","","Y"
"E61102014","02","SE","19/09/2014","201404116","06/09/2014 18:09","2","SIGLAP ROAD LEFT BEND","SIGLAP ROAD","1","1","1","1","9","20","3","2","5","70","53","0","0","0","N","Y","N","N","N","","26","R","SBS8909C NO DAMAGE (BDRG) CAM ON BOARD ATTENDED S&S ON SERVICE","On 18/09/2014, I was informed of a complaint. The latter was about on the incident date, I was doing a left bend along Siglap Road.  On the right side, there was a car (SCE113X) moving in the opposite direction. Our vehicles side swipe. I was not aware of this accident. No injury. That 's all","","I was informed on 18/09/2014.","EDSFOF02","19/09/2014 16:09","EDBDAM04","22/09/2014 08:09","","Y"
"W59442014","02","SW","11/09/2014","201404117","07/09/2014 00:09","2","bb washing machine 2","bb bus park","3","1","1","1","21","46","2","1","5","85","73","0","0","0","N","Y","Y","N","N","","26","R","sbs6778B - l/mirror cover crack","I was entering bus washing no 2 once green light appears. I moved in slowly. While moving, suddenly the L/front brush approach fast and hit L/mirror causing the cover to crack. I went to see the PA to inform. Said PA then went to off said machine aft another bus behind me. The bus,SBS 6631R behind me also got hit by the brush. I report to WS.","","bc reported on 11/09/2014","WDSSOF01","11/09/2014 16:09","EDBDAM04","22/09/2014 08:09","","Y"
"W60232014","02","SW","16/09/2014","201404118","07/09/2014 00:09","2","bbbp washing machine","bbbp washng machine","3","1","1","1","22","46","2","1","5","85","73","0","0","0","N","Y","Y","N","N","","26","R","sbs6631R - l/mirror damage(CLRG) cctv","I was washing bus when the LHS brush got hooked onto my l/mirror. It then moved to the back causing my mirror to drop. I the report to WS.","","bc reported on 16/09/2014","WDSSOF01","16/09/2014 13:09","EDBDAM04","22/09/2014 08:09","","Y"
"W59092014","02","SW","10/09/2014","201404119","07/09/2014 01:09","2","BBBP","bb bus park","3","1","1","1","22","39","3","1","5","85","70","0","0","0","N","Y","Y","N","N","","26","R","sbs3195C - rear bumper damage, engine cover dented(CLRG) cctv","aft washing, i drove to parking lot opp ws. while reversing into parking lot, rear of my bus hit the metal rubbish bin. that is all","","bc reported on 08/09/2014","WDSSOF01","10/09/2014 08:09","EDBDAM04","22/09/2014 08:09","","Y"
"E59772014","02","SE","12/09/2014","201404126","10/09/2014 14:09","2","TPE & PUNGGOL ROAD JUNCTION","TPE & PUNGGOL ROAD JUNCTION","1","1","1","1","1","27","3","2","1","70","54","0","0","0","N","Y","Y","N","Y","NP299","26","R","SBS8572P RHF CORNER BUMPER DAMAGE (TMRG) CAM ON BOARD ATTENDED S&S  OFF SERVICE","I was driving along TPE about to turn right into Punggol Road at a traffic junction when a white car hit me while he attempted to drive straight. It was a 2 lanes and I was at the outer lane while the car was on the inner lane. After hitting my bus, the car mounted the kerb on the opp. side of the road, swerved onto the opposite road before mounting the opposite side as well. As soon as the car was on the opposite lane, it sped off and I did not manage to spot the car number. No one was on my bus at that point of time. That 's all. /*T/20140912/4113*/","","","EDSFOF02","12/09/2014 16:09","EDBDAM04","22/09/2014 14:09","","N"
"W59892014","02","SW","15/09/2014","201404130","10/09/2014 19:09","3","bs20141, west coast road","west coast road","1","1","1","1","12","42","3","3","5","70","60","0","0","0","N","Y","Y","N","N","","26","R","sbs7321D - rear OS body panel cracked (HCRG) cctv","i had stopped at said bstop for pax act. aft all pax alighted, i closed the exit door but suddenly i heard sound from rear. i checked and discovered a lorry,YJ5969Zm had its front NS hit onto the rear OS of my bus. i alighted to check and exchanged particulars. i called OCC to inform and told to RTD. no injury. that is all","","bc reported on 11/09/2014","WDSSOF01","15/09/2014 09:09","EDBDAM04","22/09/2014 14:09","","Y"
