"E45642014","02","SE","07/07/2014","201402933","03/07/2014 14:07","4","Outram Pk Stn","Outram Rd","1","1","1","1","13","33","1","3","5","70","54","0","0","0","N","Y","N","N","N","","26","R","SBS6384D, POI- Right front but no damaged (EURG) Cam onboard Attended S&S on","I was driving bus svc 63 along the said rd. While enter into the said b/stop, discovered there was a m/van (GBA9274M) plying very close to my bus and my bus was being grazed by the said van. Bus resumed service after assessed the bus damage and exchanged particulars with the said driver. There were no damages to the both vehicles. That's all.","","","AMOPPR10","07/07/2014 09:07","EDBDAM04","09/07/2014 10:07","","Y"
"E47662014","02","SE","16/07/2014","201403233","07/07/2014 13:07","1","YISHUN AVE 2 BUS STOP","YISHUN AVE 2","3","1","1","1","19","42","4","2","5","70","52","0","0","0","N","Y","N","N","N","","26","R","SBS0890Z REAR BUMPER AND PANEL DENTED (TMRG) CAM ON BOARD ATTENDED S&S  ON SERVICE","I stopped at a bus stop along Yishun Ave 2. Suddenly, there was a alight jerk. I did not know that my bus was hit at the rear until one passenger informed me. I checked my bus after arrived at the interchange and found the my bus 's rear was hit by another bus(SBS6248P). The other driver claimed that the sun was very hot, he could not see properly. He apologised and admitted fault. No injury. That 's all. ","","I worked PM shifts","EDSFOF02","16/07/2014 14:07","EDBDAM04","31/07/2014 16:07","","Y"
"W46872014","02","SW","11/07/2014","201403233","07/07/2014 13:07","1","bstop, yishun Ave 2","Yishun Ave 2","1","1","2","2","17","42","3","1","5","70","52","0","0","0","N","Y","Y","N","N","","26","R","sbs6248P- front w/screen cracked(SKRG) cctv sbs890Z,svc39,BC74361,TMRG","On a/m date and time, I was driving toward Khatib Station bstop when a SBS890Z infront of me suddenly jammed brake resulting my bus to hit said bus rear. No injuries. I exchanged particulars with BC74361 and informed OCC.that is all","","BC reported on 10/07/2014","WDSSOF01","11/07/2014 15:07","EDBDAM04","31/07/2014 16:07","","Y"
"W46302014","02","SW","09/07/2014","201403236","08/07/2014 06:07","3","Clementi Ave 2","Clementi Ave 2","2","1","3","2","2","33","2","2","5","82","58","0","0","0","N","Y","Y","N","Y","","26","R","SBS 8118T      Front left corner body, bumper damaged.        (CLRG) Below rubber damaged. Cam Onboard","On 08/07/2014 at about 06:55 hrs, I was heading to turn right to Clementi Ave 2 from West Coast Road. When I have already turned right and driving along the Clenenti Ave 2, due to the heavy rain and the bus are crowded thus affect my focus and vision resulted my bus accidentally grazed against left side concrete kerb. I thought its a small problem so I continue my service. When I arrived at Clementi Interchange, I went down to checked my bus and found Front left corner body, bumper damaged. I then report the matter to ARM which I don't know his name. He then call the mechanic at Clementi Interchange to check my bus and took photo.  Thereafter ARM instruct me to make district report. That's all","","","WDSSOF01","09/07/2014 15:07","EDBDAM04","31/07/2014 16:07","","Y"
"W50072014","02","SW","29/07/2014","201403238","11/07/2014 09:07","1","Parkway Parade bstop","Parkway parade","2","1","1","1","7","42","3","3","5","86","65","0","0","0","N","Y","Y","N","N","","26","R","sbs2721R - no damage (JERG) no cctv","With reference to CFMS2014/Jul/2311, I wish to deny such incident happened. Furthermore, complainant did not provide bus number. Said complainant also mentioned that it happened at the door. I could not had missed it if a pax head was hit by door because I always check my mirros everytime. I wish to also state that such incident happened for the firt time. Therefore I deny such allegations. furthermore, there is no cctv in my bus. If such thing happened, I would had informed my RM asap.That is all.","","Bc reported on 29/07/2014","WDSSOF01","29/07/2014 14:07","EDBDAM04","31/07/2014 16:07","","Y"
"E47452014","02","SE","15/07/2014","201403239","11/07/2014 09:07","3","BRADDELL BUS PARK INGRESS","BRADDELL BUS PARK INGRESS","3","1","1","1","6","39","4","2","5","91","73","0","0","0","N","Y","N","N","N","","26","R","SBS5199D NO DAMAGE (TPRG) CAM ON BOARD ATTENDED S&S ON SERVICE","I was entering Braddell bus park. In front of my bus was a taxi. There was a gate barrier. The latter lifted up and then the taxi passed through. I followed behind the taxi and was hit by the gate barrier. No injury. That 's all. ","","","EDSFOF02","15/07/2014 11:07","EDBDAM04","31/07/2014 16:07","","Y"
"E47722014","02","SE","16/07/2014","201403241","11/07/2014 13:07","1","AMK AVE 3 BUS STOP","AMK AVE 3","2","1","1","1","17","42","4","2","5","70","66","0","0","0","N","Y","N","N","Y","","26","R","SBS8117X NO DAMAGED (YCKRG) CAM ON BOARD ATTENDED S&S  ON SERVICE"," As I was about to leave the bus stop along AMK Avenue 3, an old man about 70 yrs old ran to the front doors of my bus and so I opened and let him in. He sat at the back of the bus and after a few minutes, he came to me and said that he wanted to complain me for failing to see him coming and closed the doors before he came up the bus. No injury. That 's all. /*F/20140716/2097*/ /*CFMS : 2014/JUL/1566*/ ","","","EDSFOF02","16/07/2014 15:07","EDBDAM04","31/07/2014 16:07","","Y"
"W47952014","02","SW","17/07/2014","201403242","11/07/2014 18:07","2","b/stop 7.3 KM - Tao Nan Sch","Marine Parade Rd","1","1","1","1","11","42","1","3","1","70","52","0","0","0","N","Y","N","N","N","","26","R","SBS2727A - Front left corner bumper paint scratched ( CLRG )  No Cam","Aft paxs activities at kerbside b/stop 7.3 KM along Marine Parade Rd, I moved & then swerved to the right twds yellow box junct, when a m/car SFM7194M came from my right entered into yellow box junct & then cut into my path & then make a stopped, as a result my bus front left bumper collided into the rear left bumper of said car. I alighted to check. WOCC informed & exchange particulars & cont my svc. On 14/7, Master Ong awared but my master did not advised me to file TAC.","","Hwee Huang email dd 150714  On 14/7-16/7 I am regular PM shift duty  & had no time to file TAC.","JRADAA01","17/07/2014 13:07","EDBDAM04","31/07/2014 16:07","","Y"
"E47522014","02","SE","15/07/2014","201403245","15/07/2014 09:07","1","After Lorong 1 Geylang","Sims Ave","3","1","1","1","8","42","2","3","5","70","60","0","0","0","N","Y","Y","N","N","","26","R","SBS6601C, Rear portion damaged (BDRG) Cam onboard  Attended S&S","Before I could stop my bus at the said b/stop for pax activities and I heard sound. A pax of my bus come to approached me informed that my bus was being hit a m/bus (SBS3721J, svc 2) resulted damaged on rear poriton. No one was injured. Svc 033 rear w/screen cracked and RTD after consulted CRS. Photo taken by AS. That's all.","","","AMOPPR10","15/07/2014 15:07","EDBDAM04","31/07/2014 16:07","","Y"
"E47712014","02","SE","16/07/2014","201403245","15/07/2014 09:07","1","Aft Lrg 1 Geylang b/stop","Sims Ave","1","1","1","1","9","42","2","3","5","70","54","0","0","0","N","Y","N","N","N","","26","R","SBS3721J, POI- left v/mirror but no damaged (PRRG) Cam onboard  Attended S&S on","During incident period, I had stopped behind a m/bus (SBS6601C, svc 33) at the said b/stop when the front bus inch forwards and I follow suits swerve my bus to the right. At this juncture, my bus left v/mirror collided onto the said bus resulted it rear w/screen damaged. No one was injured. The driver did not know that I had collided onto his bus and I chase his bus until Lrg 3 Geyland b/stop. Svc 002 no damaged reported and resume service. Svc 033 rear w/screen cracked and RTD after consulted CRS. That's all.","","","AMOPPR10","16/07/2014 15:07","EDBDAM04","31/07/2014 16:07","","Y"
"W47922014","02","SW","17/07/2014","201403247","15/07/2014 19:07","2","aft bs25.5km,Alexandra road","Alexandra Road","1","1","1","1","11","33","1","3","1","70","54","0","0","0","N","Y","Y","N","Y","J/2256","26","R","sbs7377T- advertisement sticker, LHS corner bumper, LHS body panel damged, LHS centre body scratches(JERG) cctv","On a/m date and time, I was travelling along Alexandra Road. A taxi, SHB5847K overtake my bus. I let said taxi pass. Said taxi is now in the bus lane.  Aft passing by bs25.5km, I moved into the right lane because of road works ahead, I proceed straight. Suddenly, when approaching near the road works area, I heard a loud sound from LHS rear. I looked at LHS v/mirror and saw said taxi had side swiped my bus rear. I alighted to check damage. I only took said taxi reg. number as said driver did not want to exchange particulars. I inform OCC. Pax transferred to next bus. I was told to return to JEI to report to RM.I was then told to send bus back to SLBP. No injury. That is all","","BC reported on 17/07/2014","WDSSOF01","17/07/2014 11:07","EDBDAM04","31/07/2014 16:07","","Y"
"W49852014","02","SW","25/07/2014","201403248","15/07/2014 19:07","2","outside sengkang int","sengkang square","1","1","1","1","9","25","2","2","1","70","54","0","0","0","N","Y","Y","N","N","","26","R","sbs6239R - rear door lower end glass/panel scratches (SKRG) cctv","I was moving out from interchange when a taxi,SH9787L was stopping at T-junctn of the turning road leaving a gap for my bus to pass. I saw said taxi move forward so I too moved forward when suddenly said taxi stopped causing my bus to grazed said taxi. no injuries. That is all","","Bc reported on 1607/2014","WDSSOF01","25/07/2014 16:07","EDBDAM04","31/07/2014 16:07","","Y"
"E48742014","02","SE","22/07/2014","201403252","19/07/2014 12:07","1","RAFFLES BOUVELARD BUS STOP","RAFFLES BOUVELARD","1","1","3","2","15","42","4","1","5","71","54","0","0","0","N","Y","Y","N","N","","26","R","SBS6614R NO DAMAGED (BSRG) CAM ON BOARD ATTENDED S&S ON SERVICE ","I stopped at a bus stop along Raffles Bouvelard for pax activities. On my rear left side there was a SMRT Motorcycle (FBG3464P) parked on double yellow lines inside the bus stop. The motorcycle was unattended. When I started to  move away from the bus stop, my bus grazed the motorcycle lightly. No injury. That 's all. ","","","EDSFOF02","22/07/2014 11:07","EDBDAM04","31/07/2014 16:07","","Y"
"E48892014","02","SE","22/07/2014","201403254","19/07/2014 15:07","2","AMK AVE 9  & ST 62 T JUNCTION","AMK AVE 9 & ST 62 T JUNCTION","1","1","1","1","1","25","3","2","1","70","51","0","0","0","N","Y","Y","N","N","","26","R","SBS8867P LEFT SIDE SCRATCHES (YCKRG) CAM ON BOARD  ATTENDED S&S  ON SERVICE","I was travelling along AMK  AVE 9 when a SCDC Car (SJC 4305K) hit my bus on the left side when exit from AMK ST 62. No injury. That 's all.","","","EDSFOF02","22/07/2014 15:07","EDBDAM04","31/07/2014 16:07","","Y"
"W48512014","02","SW","21/07/2014","201403256","19/07/2014 19:07","2","Junct Whitley Rd","Thomson Rd","1","1","1","1","10","25","3","3","1","70","50","0","0","0","N","Y","N","N","N","","26","R","SBS2815D - Front right body,bumper & signal damaged ( BMRG ) Cam Onboard","I was driving my bus along 1st left lane of Thomson Rd heading to infornt t/light junct of Whitley Rd. Said junct showed green light in my favour, And bef crossing said junct opp dir oncoming m/car SJL6887L did not stop & turned right dir to Whitley Rd. On seeing I applied brake to stop but it was too late as a result my bus front right corner collided onto the front left portion of said car. I alighted to check. WOCC informed. Transfer paxs, I then I RTD BBBP.","","","JRADAA01","21/07/2014 15:07","EDBDAM04","31/07/2014 17:07","","Y"
"E49492014","02","SE","24/07/2014","201403269","23/07/2014 11:07","1","BRADDELL RD & LOR. 8 TOA PAYOH JUNCTION","BRADDELL RD & LOR. 8 TOA PAYOH","1","1","1","1","14","33","1","2","5","70","52","0","0","0","N","Y","Y","N","N","","26","R","SBS6109H FRONT LEFT SIDE SIGNAL LIGHT COVER DAMAGED (TPRG) CAM ON BOARD  ATTENDED S&S ON SERVICE","I was behind a vehicle (SBZ9930X) while turning left from lorong 8 Toa Payoh into Braddell Road. The vehicle suddenly stopped. As I looked to the right side to check any incoming vehicles, my bus hit the vehicle in front. No injury That 's all. ","","","EDSFOF02","24/07/2014 16:07","EDBDAM04","04/08/2014 09:08","","Y"
"W49452014","02","SW","24/07/2014","201403344","24/07/2014 07:07","1","Bus Bay _ Blk 710","Jurong West Street 71","1","1","1","1","4","42","3","3","5","85","83","0","0","0","N","Y","N","N","N","","26","R","SBS3200X - U/D Saloon front left w/screen glass cracked ( BLRG ) Cam Onboard","My bus was off-svc from BLI to on svc at b/stop 3.1 KM along JR West Ave 5. And along JR West St 71 at bus bay there was a SBST DD bus stopping at said b/stop, I then overtook said b/stop & then stopped infront to svc plate. Aft changing svc plate, I then swerved my bus to the right when I heard sound came from the Upp saloon, I stopped my bus at the t/light junct & went to Upp saloon to check & saw upp deck front left w/screen glass cracked & hit against tree branches, as I late therefore aft checking my bus I moved off to JR West Ave 5 to pick-up paxs. At BLI, I reported to Master Lee & BC who covering ARM duty & he told me to cont my svc & to report next trip.","","","JRADAA01","24/07/2014 14:07","EDBDAM04","05/08/2014 10:08","","N"
"W53012014","02","SW","11/08/2014","201403444","08/08/2014 11:08","1","Yio Chu Kang Link slip boundary Rd","Yio chu Kang Link","1","1","1","1","12","22","1","2","1","70","54","0","0","0","N","Y","Y","N","N","","14","R","sbs969G - SGRG,","I was driving alg yio chu link twds S'goon Int when near juncn of Yio Chu Kang Link and boundary Rd, I was turning left twds the zebra crossing when accidentally hit onto the car, SFP8113A. that is all","","BC reproted on 08/08/2014","WDSSOF01","11/08/2014 14:08","SFALPR04","13/08/2014 11:08","","Y"
"E53322014","02","SE","12/08/2014","201403445","08/08/2014 17:08","2","AMK AVE 1","AMK AV E 1","1","1","1","1","7","33","3","2","5","70","54","0","0","0","N","Y","Y","N","N","","14","R","SBS6618E RIGHT FRONT SCRATCHES & PAINT PEEL OFF (AMKRG) CAM ON BOARD ATTENDED S&S ON SERVICE","I was driving along AMK Ave 1 when a car (SFZ401T) side swipe my bus. The latter hit my bus. No injury. That 's all. ","","","EDSFOF02","12/08/2014 14:08","SFALPR04","13/08/2014 11:08","","Y"
"E52992014","02","SE","11/08/2014","201403449","09/08/2014 01:08","2","AMK BUS PARK","AMK BUS PARK","3","1","1","1","22","39","4","1","5","70","67","0","0","0","N","Y","Y","N","N","","14","R","SBS6301T LEFT SIDE EIXT DOOR WINDOW DAMAGED (BSRG) CAM ON BOARD ATTENDED S&S OFF SERVICE ","While reversing in AMK Bus park, my bus sideswipe with another unattended parked bus (SBS8756B). The lighting in the parking lot was dimmed, could not see clearly. No injury. That 's all. ","","","EDSFOF02","11/08/2014 14:08","SFALPR04","13/08/2014 11:08","","N"
"W53592014","02","SW","13/08/2014","201403467","04/08/2014 15:08","1","yio chu Kang Rd bs64109","yio chu kang road","2","1","1","1","18","33","2","1","5","86","61","0","0","0","N","Y","Y","N","N","","14","R","sbs0963Y - SGRG","Ref CFMS2014/Aug/0348, I was driving alg Yio Chu Kang Rd twds Boundary Rd. approaching junctn of YCK Rd / HG Ave 9, t/light was green. I cont to drive. I saw a car stopped at said junctn so I drove on. The said car made a turn into Hg ave 9, so as to avoid hitting said car, I applied brake to stop. Due to that, a M/pax fall onboard. I helped him up and asked him if he is ok. He replied he was alright. He also mentioned it was not my fauly. Seeing no visible injuries, I cont svc to SGI. That is all","","BC reportd on 12/08/2014","WDSSOF01","13/08/2014 15:08","SFALPR04","14/08/2014 09:08","","Y"
"W53752014","02","SW","14/08/2014","201403509","08/08/2014 08:08","9","Ghim Moh Term parking lot","Ghim Moh Road","1","1","1","1","4","38","3","1","5","70","67","0","0","0","N","Y","N","N","N","","14","R","SBS2835X - Rear ctr bumper scratched ( CLRG ) No Cam","Bus was off svc from Science Pk Dr twds Ghim Moh Term. Along Ghim Moh Rd, I then filtered to left twds parking lot, at the    terminal parking lot, I was reversing my bus to stop at svc 92 boarding awaiting to pick-up pax. During 3 point turning reversing when suddenly I heard sound came from the rear of my bus. I stopped my bus & checked but my both v/m could not see anything, a m/ch approached me & informed me that my bus had hit his taxi. I looked at v/m could not see anything, I alighted to check & proceed to the rear of my bus & saw my bus rear bumper had collided into the front portion of taxi SHD2354A . WOCC informed to exchange particular.","","I am a regular SS & had no time to file TAC","JRADAA01","14/08/2014 13:08","SFALPR04","17/08/2014 08:08","","Y"
"E53692014","02","SE","14/08/2014","201403513","13/08/2014 15:08","2","THOMSON ROAD","THOMSON ROAD","1","1","1","1","1","33","1","2","5","70","54","0","0","0","N","Y","Y","N","N","","14","R","SBS5117R RIGHT SIDE REAR SIGNAL LIGHT DAMAGE(EURG) CAM ON BOARD ATTENDED S&S ON SERVICE","I was driving along Thomson Road about to enter a bus stop in front of Novena MRT station when my bus right signal light and the car (GBA8869D) 's left side mirror side swipe. No injury. That 's all. ","","","EDSFOF02","14/08/2014 11:08","SFALPR04","17/08/2014 08:08","","Y"
"E53682014","02","SE","14/08/2014","201403514","13/08/2014 16:08","3","DOVER ROAD T TRAFFIC JUNCTION","DOVER ROAD","1","1","2","2","8","25","3","2","5","70","54","0","0","0","N","Y","Y","N","N","","14","R","SBS8523G LEFT SIDE SCRATCHES (BDRG) CAM ON BOARD ATTENDED S&S ON SERVICE","I was driving along Dover Road passing through a T traffic Junction. My bus then side swipe with another car (SKJ1525M) moving out from the side road on my left side. No injury. That 's all.","","","EDSFOF02","14/08/2014 10:08","SFALPR04","17/08/2014 08:08","","Y"
"W53712014","02","SW","14/08/2014","201403515","13/08/2014 17:08","2","marina centre terminal","raffles boulevard","1","1","1","1","6","38","3","1","5","91","73","0","0","0","N","Y","Y","N","N","","14","R","sbs6192R - rear LHS cctv cam damaged, rear LHS corner body panel dented (BMRG) cctv","I arrived at Marina Centre Term and wanted to park. Earlier, there was a chain collision on the RHS of the parking lots so I wanted to be safe and decided to park on the LHS. So I parked as normal. When I wanted to start back my svc, I exit out from parking lot and accidentally sideswiped the barrier on my rear LHS. It was my first time doing said svc. At first bstop, I inform OCC. I then resume svc. End of service then I report to BBWS. that is all","","BC reported on 14/08/2014","WDSSOF01","14/08/2014 12:08","SFALPR04","17/08/2014 08:08","","Y"
"W54082014","02","SW","15/08/2014","201403518","13/08/2014 20:08","2","clementi ave 6 slip commonwealth ave","commonwealth ave","1","1","1","1","12","25","2","1","5","70","52","0","0","0","N","Y","Y","N","N","","14","R","sbs7513S - LHS bumper damaged (BLRG) cctv","I was driving alg Clementi Ave 6 twds Commonwealth Ave West. At said slip road, there was a car, SGP245T on the left lane  entering into c'wealth Ave West. I was on the RHS lane. I saw said car already moving so I checked right and proceeded out when suddenly I heard a sound. My bus front LHS hit said car RHS rear. I alighted and asked said driver why he braked and stopped. He mentioned there was a cyclist at the side of the road causing him to braked. I exchange particulars. I informed OCC. I cont svc back to BNVT. Aft duty then I reported to WS. No injury. that is all","","BC reported on 15/08/2014","WDSSOF01","15/08/2014 15:08","SFALPR04","30/09/2014 09:09","","Y"
"W53802014","02","SW","14/08/2014","201403520","13/08/2014 22:08","2","Level 3 at svc 506 parking lot","Soon Lee Bus Park","3","1","1","1","18","38","4","1","5","70","67","0","0","0","N","Y","N","N","N","","14","R","SBS8041E - Rear w/screen glass damaged ( JERG ) Cam Onboard SBS7458T - Front w/screen glass damaged (unattended )","My bus was at SLBP Level 3. At the level 3 driveway, I was reversing my bus to park at the svc 506 parking lot, aft reversing bus at the parking lot when I heard sound came from the rear of my bus. I alighted to check & saw the rear w/screen of my bus had collided into behind stationary bus SBS7458T at the front w/screen. And I noticed said DD parked with the front portion near to white line of the parking lot. SL w/shop reported.","","","JRADAA01","14/08/2014 14:08","SFALPR04","17/08/2014 08:08","","N"
"W54072014","02","SW","15/08/2014","201403521","14/08/2014 01:08","2","Bus Washing Bay","Ayer Rajah Bus Park","3","1","1","1","16","46","4","1","5","85","73","0","0","0","N","Y","N","N","N","","14","R","SBS6630T - BC's side window glass broken ( BMRG ) Cam Onboard","I had completed my duty at AYBP & was sending my bus for bus washing. I moved & entered into bus washing bay, my bus front portion pushed the rightside brush & washing brush started to spin & suddenly bouned back & hit onto the right front v/m & right v/m hit against BC's side window glass.  I then cont washing.","","","JRADAA01","15/08/2014 14:08","SFALPR04","17/08/2014 08:08","","N"
"E54342014","02","SE","18/08/2014","201403541","21/07/2014 10:07","1","UPPER SERANGOON ROAD-NEAR NEX MALL","UPPER SERANGOON ROAD","2","1","1","1","10","33","2","2","5","86","78","0","0","0","N","Y","N","N","Y","NP299","14","R","SBS3199S NO DAMAGE (YCKRG) CAM ON BOARD ATTENDED S&S ON SERVICE","On 12/08/2014, I was informed of a complaint against me. The complaint was about a passenger lost steps and fell from the 2nd deck to the first deck. However, I was unaware as there was a lot of passengers in the bus. I was unsure of what injuries the passenger had sustained. that 's all. /*F/20140814/2112*/ /*CFMS : 2014/AUG/0768*/","","I was informed on 12/08/2014","EDSFOF02","18/08/2014 13:08","SFALPR04","18/08/2014 14:08","","Y"
"E51532014","02","SE","04/08/2014","201403570","02/08/2014 16:08","1","BISHAN RD & ST 11 TRAFFIC JUNCTION","BISHAN RD & ST 11 TRAFFIC JUNC","1","1","1","1","20","27","2","2","1","70","54","0","0","0","N","Y","N","N","N","","26","R","SBS8422P NO DAMAGED (BSRG) CAM ON BOARD ATTENDED S&S ON SERVICE","I was turning right at a traffic junction from Bishan Road into Bishan st 11. Suddenly, there was a pte car (SJD888R) on my right side turning at the same time. The car side swipe my bus. We exchanged particulars. No injury. That 's all.  ","","","EDSFOF02","04/08/2014 16:08","EDBDAM04","20/08/2014 10:08","","Y"
"W52202014","02","SW","07/08/2014","201403571","02/08/2014 16:08","2","Upp Sgoon Rd, aft bs18.8km","Upp Serangoon Road","1","1","1","1","6","26","2","3","5","70","54","0","0","0","N","Y","Y","N","Y","","26","R","sbs3737P - nearside centre body panel scratched (HCRG) cctv","I was driving alg the extreme left lane of upp Serangoon Rd twds HG Central. At that time, a car was infornt and it turned left into the road leading to HDB flats. I then swerved out to oevrtake. While overtaking, I heard a sound. I checked and discovered that said unknown car had stopped. the nearside center of my bus had grazed against the rear offside of said car. Said car driver approached me and provide his particulars but not his car number. I was instructed to cont svc. No visible injuries. that is all","","Bc reproted on 05/08/2014","WDSSOF01","07/08/2014 10:08","EDBDAM04","20/08/2014 10:08","","Y"
"W51802014","02","SW","06/08/2014","201403572","02/08/2014 19:08","2","TPE(SLE) exit, Tampines Ave 7","TPE","1","1","1","1","8","33","2","1","5","70","60","0","0","0","N","Y","Y","N","N","","26","R","sbs6606P - rear RHS marker light damaged(SKRG) cctv","I was waiting along SLE area at slip road when a vehicle grazed my bus when it was moving off. At first, I thought someone onboard fell. Aft asking around, I then realised that vehicle had grazed my bus. Said vehicle left scene. I informed OCC and was instructed to cont svc. Later, a F called RG abt said acciden.t That is all","","BC reported on 04/08/2014","WDSSOF01","06/08/2014 09:08","EDBDAM04","20/08/2014 10:08","","Y"
"E51412014","02","SE","04/08/2014","201403574","02/08/2014 21:08","2","KALLANG BAHRU & BOON KENG RD X JUNCTION","KALLANG BAHRU & BOON KENG RD X","1","1","1","1","15","27","3","2","1","70","54","0","0","0","N","Y","Y","N","N","","26","R","SBS8464T REAR BUMPER SCRATCHES (TPRG) CAM ON BOARD ATTENDED S&S  ON SERVICE","I was turning left at a traffic junction between Kallang Bahru and Boon Keng Road. At that time, there was road works on in progress. Many plastic cones were placed on my left side.As I turned left at the yellow box, a van (GU2205U) behind my bus side swipe the rear of my bus.When I reached about 1st bus stop along Boon Keng Road, the van driver catched up with me. He gave me his name card.  No one was injured. That 's all. ","","","EDSFOF02","04/08/2014 14:08","EDBDAM04","20/08/2014 10:08","","Y"
"W52182014","02","SW","07/08/2014","201403575","02/08/2014 22:08","2","Tg pagar road","tg pagar road","1","1","1","1","16","25","2","1","1","70","54","0","0","0","N","Y","Y","N","N","","26","R","sbs7455B - rear door damaged (SKRG) cctv","I was following a lorry,XT7211G trying to make a turn at the junction aft bstop05271 when accident took place. As I was negotiating the turn, said lorry suddenly stopped and caused the accident. I was unable to react hence my rear door was damaged. I checked no injuries and went to exchange particulars with lorry driver. no injuries. that is all","","Bc reported on 05/08/2014","WDSSOF01","07/08/2014 10:08","EDBDAM04","20/08/2014 10:08","","Y"
