"acc_rep_num ","company_code","DIST_CODE","report_date","ip_number","accident_dt_time","shift_code","plce_of_acc","road_name1","acc_type","nature_of_acc","wthr_code","road_sur_code","op_hrs_code","type_loc_code","traf_vol_code","traf_flow_code","traf_cntrl_code","col_with_code","type_of_col_code","srs_inj","minor_inj","fatal","bus_towed","sketch","photo_taken","mech_fault","pol_report","pol_rep_num","dutyio_code","release_status","damage_to_bus","Facts_txt","brief_part","rsn_for_late_rep","create_by","create_dt","modify_by","modify_dt","mig_flag","off_on_svc"
"E07732015","02","SE","09/02/2015","201500749","06/02/2015 16:43","2","Alighting berth","Ang Mo Kio Bus Interchange","3","1","1","1","5","37","2","1","5","70","54","0","0","0","N","Y","Y","N","N","","14","R","SBS8701J, POI- Scratches on right window panel","After alighted my pax at the alighting berth I intend to pick up my pax at the svc 265 boarding berth when my bus sideswipe with another bus (SBS9644J svc 86). As a result my bus sustained minor scratches on right window panel.The said bus sustained damaged on it dislodged from the bus. Svc 265 continued service after assessed by AMI ARM Kwan. Thats all.","","","amoppr10","09/02/2015 14:03","amoppr10","09/02/2015 16:22","","N"
"E07932015","02","SE","10/02/2015","201500749","06/02/2015 16:40","3","AMK INT.","AMK INT.","3","1","1","1","17","37","4","1","5","70","54","0","0","0","N","Y","Y","N","N","","14","R","LEFT MIRROR BRACKET DMG","I was moving along the driveway in AMK int. I saw a bus(SBS8701JSVC 265) on left side. After alighting passengers SBS8701J  wanted to move out. Hence I stopped to give way. But it continued to move and hit my bus even though I hornedsbs8701J a few times. My bus have CCTV inside but not outside. No injury. That s all.","","Due to weekend","edsfof02","10/02/2015 10:52","","10/02/2015 10:52","","N"
"E08522015","02","SE","12/02/2015","201500750","06/02/2015 18:08","3","SERANGOON ROAD IN FRONT TEKKA CENTRE","SERANGOON ROAD","1","1","1","1","17","33","1","1","5","72","54","0","0","0","N","Y","Y","N","N","","14","R","LEFT REAR SCRATCHES","My bus was stationary queueing behind other vehicles at a pedestrian crossing along serangoon road. Suddenly heard a loud bang. Upon checking found that an electric bicyclist had hit my bus. Do not know where he came from. Because he is a malaywe had communication problem. No injury. That s all.","","I worked split shifts","edsfof02","12/02/2015 14:06","","12/02/2015 14:06","","N"
"E07942015","02","SE","10/02/2015","201500751","09/02/2015 09:24","3","JALAN EUNOS BUS STOP","JALAN EUNOS","3","1","1","1","9","42","4","2","5","70","52","0","0","0","N","Y","Y","N","N","","14","R","NO DMG","While leaving a bus stop along Jalan Eunos my bus accidentally hit the rear of the bus (SBS6280USvc : unknown) in front. The latter was stationary at that time. No injury. That s all.","","","edsfof02","10/02/2015 11:09","","10/02/2015 11:09","","N"
"W07792015","02","SW","09/02/2015","201500751","09/02/2015 09:19","1","Jalan Eunos","Jln Eunos - Opp Eunos Stn","1","1","1","1","8","42","3","1","5","70","60","0","0","0","N","Y","Y","N","N","","14","R","SBS6280U - Rear rght top w/screen glass cracked, right rear body scratched ( BMRG )","I had stopped my bus at the kerbside b/stop 22.8 along Jln Eunos for alighting paxs. Aft paxs activities I waited for my infront bus to move when suddenly I heard sound came from the rear right of my bus. I checked on my right side v/m & saw behindmy bus SBS7444H svc 025 had overtook to his right. I alighted to check. Left front v/m had collided onto the rear right w/screen of my bus. BC was a PRC. WOCC informed.","","","jradaa01","09/02/2015 14:51","","09/02/2015 14:51","","N"
"E08062015","02","SE","10/02/2015","201500752","09/02/2015 11:45","1","Junc of Marrymount Rd","Marrymount Rd","2","1","1","1","11","27","2","3","1","86","78","0","0","0","N","Y","N","N","Y","NP299","14","R","SBS8689L, No damaged","I was driving bus svc 13 along Marrymount Rd towards Ang Mo Kio Ave 6 at the junc of Ang Mo Kio Ave 1 and Ave 6. While approaching the said junc the traffic light turn amber and I prepared to stop. As I was coming to a stop I heard sound comingfrom the back and saw one maid and a child on floor. I immediately rendered my assistance. However they inform me that they do not require immediate medical attention. Thus I carried on the journey and the alighted at the b/stop of Blk 208.During the incident there were 2 witnesses who saw them failing down while my bus was coming to a stop. I am lodging this report for record purpose. Thats all.","","","amoppr10","10/02/2015 15:12","","10/02/2015 15:12","","N"
"E08022015","02","SE","10/02/2015","201500753","09/02/2015 13:20","1","LORONG 1 GEYLANG PEDESTRIAN CROSSING","LORONG 1 GEYLANG","1","1","1","1","15","33","1","1","2","70","54","0","0","0","N","Y","Y","N","Y","T/2015","14","R","RIGHT MIRROR DMG","I stopped at a pedestrian crossing along Lorong 1 Geylang. There was a lorry on my right side behind moving at a fast speed. As it passed my bus it side swipe my right mirror. The lorry did not stopped. No injury. That s all.","","","edsfof02","10/02/2015 14:43","","10/02/2015 14:43","","N"
"W08532015","02","SW","12/02/2015","201500754","09/02/2015 16:45","2","Marine Parade Road","Marine Parade Rd","1","1","1","1","6","27","3","3","1","70","54","0","0","0","N","Y","N","N","N","","14","R","SBS2822H - Left rear tyre body no damaged ( BMRG )","Aft paxs activities at b/bay along Marine Parade Rd I then filtered my bus to the right & I saw a m/car SJS6791S came from behind at the ctr lane & then swerved to 1st right outer lane & then stopped behind m/vehs at the red light junct of JooRd. And I was behind said car & then filtering to the extremely 1st right outer lane the left rear body ( tyre ) of my bus then grazed against the right rear body of said car. I then stopped my bus alighted to check informed WOCC exchangedparticulars & then cont my svc.","","","jradaa01","12/02/2015 14:19","","12/02/2015 14:19","","N"
"W08012015","02","SW","10/02/2015","201500755","09/02/2015 16:45","3","Holland Rd","Holland Rd b/stop - Lien Twrs","1","1","1","1","4","42","3","1","5","70","54","0","0","0","N","Y","N","N","N","","14","R","SBS2992A - Right front v/m glass damaged ( JERG )","Aft paxs activities at bus bay 14.8 KM along Holland Rd I moved out & then stopped at the bus bay exit to check any oncoming m/veh on my right. When suddenly I noticed a black colour pte bus came from behind drove at fast speed & by-passing my bushad its left front v/m hit onto the right front v/m of my bus. Aft accident said pte bus did not stop & sped off but due to infront t/light Queensway red light said pte bus then stopped at said junct. I alighted & went over to said pte bus &informed him that my bus right front v/m glass was damaged I wanted to take photo but he refused I then jotted down said pte bus reg no PC9000Z. I returned to my bus informed WOCC & advised me to wait for CRS. Tr paxs. Aft CRS replaced my v/mI then drove my bus back to SLBP.","","","jradaa01","10/02/2015 14:25","","10/02/2015 14:25","","N"
"E08132015","02","SE","10/02/2015","201500756","09/02/2015 17:38","2","MATTAR ROAD O/S MACPHERSON PRI. SCHOOL","MATTAR ROAD","1","1","1","1","9","20","2","1","5","70","54","0","0","0","N","Y","Y","N","N","","14","R","NEARSIDE REAR BODY","On the accident date & time while operating svc 135 SBS8380B along Matter road reducing driving speed to conform to traffic red light. A van PA2183Y on the left lane collided onto the bus s exit door. The bus sustained damages on the nearside rearbody while the van s RHS view mirror broke. That s all.","","","edsfof02","10/02/2015 17:00","","10/02/2015 17:00","","N"
"W07952015","02","SW","10/02/2015","201500757","09/02/2015 17:42","3","C'Wealth Ave / Nth Buona Vista Rd","C'Wealth Ave","1","1","1","1","4","22","4","1","3","70","60","0","0","0","N","Y","N","N","N","","14","R","SBS2720T - Rear ctr bumper damaged ( CLRG )","I was driving my bus coming from C’Wealth Ave turning left dir to Nth Buona Vista Rd. When I saw a ped was crossing at a zebra crossing I then stopped my bus at a zebra crossing abt 6 secs when I heard sound came from the rear of my bus I did notnot alighted to check due to behind oncoming m/vehs I moved off & then stopped at the roadside said car then stopped infront of my bus. I alighted to check the m/car’s driver was a male European refused to exchange his particulars & informed hewanted to report & then drove off. I then cont my svc.","","","jradaa01","10/02/2015 11:23","","10/02/2015 11:23","","N"
"E08112015","02","SE","10/02/2015","201500758","10/02/2015 06:01","1","Opps Christ The King Church","Ang Mo Kio Ave 8","2","1","1","1","1","42","2","1","5","86","63","0","1","0","N","Y","Y","N","Y","NP299","14","R","SBS8383T, No damaged","I was driving bus svc 22. While I was stopping at the said b/stop I saw a subject (an elderly male Malay) from opps the road running across the road to catch my bus. As such I waited for him and my bus was stationary. When he reached he missedhis footstep and fell right in front of the buss door step. I then helped him and called OCC. Ambulance activated. The rest of my pax then alighted from my bus and boarded another bus svc 22. He then conveyed to hospital after attended by paramedicGinselle. I have a witness at scene. I am lodging this report for record purpose. Thats all.","","","amoppr10","10/02/2015 16:30","amoppr10","10/02/2015 16:31","","N"
"W08352015","02","SW","11/02/2015","201500759","10/02/2015 07:00","3","c'wealth ave west bef bs27.8km","commonwealth ave west","2","1","1","1","3","33","3","3","5","86","78","0","0","0","N","Y","Y","N","N","","14","R","sbs3824X - HCRG, cctv","I was on the extreme left lane alg said location twds Clmenti Ave 3. On reaching said bs I heard as if somone had fallen. I checked and discovered a F/Malay pax abt 10Y lying on the floor near the exit door.She does not require med attn as she claimed she was nt inj. OCC informed. Both alighted at said bstop. I then proceed to Clementi Int. No inj. That is all","","","wdssof01","11/02/2015 15:50","","11/02/2015 15:50","","N"
"E08392015","02","SE","11/02/2015","201500760","10/02/2015 07:10","1","CHAI CHEE ROAD BUS STOP NEAR BLK 24","CHAI CHEE ROAD","2","1","1","1","5","42","4","1","5","86","82","0","0","0","N","Y","Y","N","Y","F/2015","14","R","NO DMG","I stopped at a bus stop along Chai Chee Road for pax activities. As I was about to move off saw an elderly man running and waving at my bus. As such I stopped to allow him to board. After he boarded another elderly lady tried to board the bus.However I accidentally closed the doors and hit the elderly lady who fell to the ground. I immediately went down the bus to help her onto the bus. I called EOCC and they activated ambulance. The ambulance came but she was not sent to hospital as shehad no injury. Her particulars : Yeo Im Neo S0629369G. That s all.","","","edsfof02","11/02/2015 16:18","","11/02/2015 16:18","","N"
"W07102015","02","SW","05/02/2015","201500761","04/02/2015 13:50","1","Clementi Bus Interchange Driveway","Clementi Bus Interchange","3","1","1","1","19","37","3","1","1","85","58","0","0","0","N","Y","Y","N","N","","23","R","SBS8079Y  Front left view mirror dropped. CCTV  (CLRG)","As normal after picked up passengers at Clementi Interchange svc 285 boarding berth I was driving along the Interchange driveway towards the exit point. As I was tired and lack of focus resulted my bus front left view mirror grazed against the sidewall of the Clementi Interchange. I then went down to checked and found my bus sustained front left view mirror dropped. I report to my route master - Goh and route master - Goh assist me to transferred my paxs to the next bus. Route Group Technicianthen assist to take over my bus and returned back to the parking lot. No injury reported. My route master instructed me to report to Bukit Batok workshop and make district report as well. That is all.","","","wdblrs04","05/02/2015 16:23","","05/02/2015 16:23","","N"
"W06732015","02","SW","04/02/2015","201500762","04/02/2015 13:53","1","Jurong West Street 62 - Blk 622","Jurong West St 62","1","1","1","1","16","33","4","3","2","85","76","0","0","0","N","Y","N","N","N","","23","R","SBS3420C - Exit door glass left cracked ( BLRG )","Aft paxs activities at kerbside b/stop along JR West St 62 I then left said b/stop. Aft crossing the ped t/light junct when I heard cracked sound came from my bus. And I heard a pax saying that my bus door glass had cracked & he saw a boy actionliked throwing something. I then stopped at roadside. I alighted to check & I saw 3 boys student ( 2 malay & 1 chinese ) & I then asked them who threw & 2 malay student pointed to me it was him the Chinese boy wanted to run away & I asked him tocome over & to show him the damaged & I asked him to follow me to Inter & he told me that his father would scold him & he wanted to go home. I then asked my colleague to help me to stop from leaving & I took photo of him & let him left the scene.WOCC did not responded I then cont my svc to BLI.","","","jradaa01","04/02/2015 15:43","","04/02/2015 15:43","","N"
"E07922015","02","SE","10/02/2015","201500763","04/02/2015 15:39","9","Along Jalan Jurong Kechil","Jalan Jurong Kechil","2","1","1","1","5","42","2","3","5","86","74","0","0","0","N","Y","N","N","Y","NP299","23","R","SBS3653Y, No damaged","I was informed by my RM that someone had lodged a complain against me. The incident happened on 04/02/2015 at about 1539hrs while my bus svc 157 was traveling along Jalan Jurong Kechil. A male pax allege that I have jammed barke as a result hehad injured his knee. I wish to state that I have no knowledge of such incident and the said male pax did not approached me after the incident. Thats all.","","I wish to state that I have no knowledge of such incident and the said male pax did not approached me after the incident.","amoppr10","10/02/2015 10:25","","10/02/2015 10:25","","N"
"E07032015","02","SE","05/02/2015","201500764","04/02/2015 15:50","1","AMK AVE 6","AMK AVE 6","1","1","1","1","18","33","3","2","5","70","54","0","0","0","N","Y","Y","N","Y","T/2015","23","R","RIGHT REAR DMG","I was driving along AMK ave 6 lane 3. A blue comfort taxi which was driving on lane 2 (my right side) side swipe my bus. I then drove a little further and pulled over. I walked over to the back of my bus. I saw the taxi turning left into AMK StreetSt 12 and sped off. I did not manage to see the registration plate of the taxi.  No injury. That s all.","","","edsfof02","05/02/2015 15:23","","05/02/2015 15:23","","N"
"W07182015","02","SW","06/02/2015","201500765","04/02/2015 17:07","3","macpherson rd bef bs7.0km","macpherson rd","1","1","1","1","10","33","2","3","5","70","54","0","0","0","N","Y","Y","N","N","","23","R","sbs6813H - NS front v/m cover cracked, HCRG, cctv","I was on the extreme left lane heading twds Toa Payoh. On reaching the side road of Tannery Rd I noticed a crane WB5619A had stopped at its ingress of the said side road and its hook was protruding out. I swerved to the right to keep a dist.As I was passing by it suddenly I heard sound. I checked and discovered that its hook had came out and hit onto the NS front v/m cover of my bus. OCC informed. Said crane driver refused to furnish particulars. no inj.","","","wdssof01","06/02/2015 09:30","","06/02/2015 09:30","","N"
"E06952015","02","SE","05/02/2015","201500766","04/02/2015 19:57","2","8427BNEW BRIDGE TERMINAL","NEW BRIDGE TERMINAL","3","1","1","1","11","38","4","1","5","70","67","0","0","0","N","Y","Y","N","N","","23","R","REAR RIGHT SIDE BUMPER DMG","While reversing in New Bridge Terminal my bus accidentally hit another unattended bus (SBS3839D SVC 2). The driver of the latter already finished work. No injury. That s all.","","","edsfof02","05/02/2015 13:34","","05/02/2015 13:34","","N"
"E07282015","02","SE","06/02/2015","201500766","04/02/2015 19:57","3","NEW BRIDGE TERMINAL","NEW BRIDGE TERMINAL","3","1","1","1","21","38","4","1","5","70","56","0","0","0","N","Y","Y","N","N","","23","R","RIGHT REAR DMG","My bus was unattended in the parking lot in New Bridge Terminal when it was hit by sbs8427BSvc 12. I already finished work. No injury. That s all.","","","edsfof02","06/02/2015 12:04","","06/02/2015 12:04","","N"
"W08162015","02","SW","11/02/2015","201500767","04/02/2015 20:36","2","corporation road bef X bn lay drive","corporation road","1","1","1","1","10","33","3","3","1","70","54","0","0","0","N","Y","Y","N","N","","23","R","sbs8881Y - rear rhs body panel dmg, CLRG, cctv","aft pac act at bstop I need to go from extreme left to extreme right lane to make a right turn ahead into Bn Lay Dr. I had kept a proper lookout from 1st lane to the 2nd lane and then ensure there is no incoming vehicle bef switching to 3rd lane.While crossing over from the 2nd to 3rd lane suddenly my bus rear rhs was hit by a towing vehicle.","","bc reported to Rg on 06/02","wdssof01","11/02/2015 08:56","","11/02/2015 08:56","","N"
"W06842015","02","SW","05/02/2015","201500768","05/02/2015 05:10","1","Soon Lee Bus Park","Level 4 Bus Park parking lot","3","1","1","1","1","39","4","1","5","91","73","0","0","0","N","Y","N","N","N","","23","R","SBS8773B - Rear right corner bumper, talilamp & body damaged ( BLRG )","My bus was parked at SLBP level 4 at svc 252 parking lot. Aft 1st parade task I boarded my bus to leave bus park. I drove out & then turned left when I heard sound came from the rear right portion of my bus. I stopped & alighted to check & saw thethe rear right corner of my bus had grazed against the protector railing of lamp post at svc 254 & 252. I then reported to stby mechanic at bus park.","","","jradaa01","05/02/2015 09:20","","05/02/2015 09:20","","N"
"W07582015","02","SW","09/02/2015","201500769","05/02/2015 06:59","1","Bedok Interchange alighting berth","Bedok Interchange","2","1","1","1","12","37","2","1","5","86","64","0","0","0","N","Y","Y","N","Y","d/2015","23","R","sbs6026M - BMRG, cctv","On incident date my 2nd trip was from BMI to Bedok Int. I was driving svc 16. Everything was normal and I ended shift at 1513h. I wish to state that I was not notified by any pax that someone had fell. On 07/02 at 1100h I was informed by RM Christhat a pax claimed to had fell at Bedok Int alighting berth on 05/02. I had no knowledge of such incident nor any pax inj during my shift. that is all","","bc was informed of case on 07/02","wdssof01","09/02/2015 10:53","","09/02/2015 10:53","","N"
"W07892015","02","SW","09/02/2015","201500770","05/02/2015 07:26","1","HCI boarding berth 2","hg central interchange","3","1","1","1","2","37","2","1","5","70","54","0","0","0","N","Y","Y","N","N","","23","R","sbs3000G- OS window glass scratches, HCRG, cctv     sbs9390R, svc107,front w/screen shattered, NS v/m dmgd","Aft pax act at boarding berth 1 I was abt to move off. I saw a svc89 moved into berth 2. I confirmed my right rear was clear and I slowly swerve to the right when suddenly I heard horn sound from the rear. It was too late as sbs9390R had grazedagaisnt the panel of my bus. Both buses damaged. no inj. that is all","","bc reported to RG on 06/02","wdssof01","09/02/2015 17:04","","09/02/2015 17:04","","N"
"W08192015","02","SW","11/02/2015","201500770","05/02/2015 07:26","3","HG central Int bef berth 4","hougang central int","3","1","1","1","5","37","2","1","5","70","54","0","0","0","N","Y","Y","N","N","","23","R","sbs9390R - NS front w/screen, v/m dmgd, HCRG, no cctv     sbs3000G, w/0789/2015","I was driving alg the driveway near to ped crossing bef boarding berth 2 I saw BCs crossing so I stopped. I then saw SBS3000G suddenly swerved out from boarding berth1 and its OS body grazed my bus causing damages to both buses. No inj. that is all","","bc reported to rg on 06/02. district rcvd report on 10/02","wdssof01","11/02/2015 10:12","","11/02/2015 10:12","","N"
"W07072015","02","SW","05/02/2015","201500771","05/02/2015 07:30","1","Jln Buroh / Pandan Rd","Jln Buroh","1","1","1","1","5","25","3","2","1","90","76","0","0","0","N","Y","N","N","N","","23","R","SBS9607S - Right rear last piece window glass cracked ( JERG )","I was driving my bus at the 1st right outer lane Jln Buroh turning right dir to Pandan Rd. Said junct showed green light I slowed down my bus & saw opp dir no oncoming m/veh I then make a right twds ComfortDelgro b/stop when I heard sound camefrom the right rear portion of my bus. Then followed by a pax m/Chinese approached me & informed me that my bus at the rear glass had cracked. I then stopped at b/stop 7.1 KM to check. WOCC informed transfer call to CRS. Then I was told totransfer paxs then RTD to SLBP.","","","jradaa01","05/02/2015 16:00","","05/02/2015 16:00","","N"
"E07592015","02","SE","09/02/2015","201500772","07/02/2015 08:00","1","TAMPINES ROAD","TAMPINES ROAD","1","1","1","1","7","33","2","2","5","70","52","0","0","0","N","Y","Y","N","N","","23","R","FRONT WINDSCREEN DAMAGE","My bus hit the rear of a lorry (XD5373K) in front when it suddenly stopped. The lorry suddenly stopped could be due to the traffic in front of it. No injury. That s all.","","","edsfof02","09/02/2015 10:57","","09/02/2015 10:57","","N"
"E08092015","02","SE","10/02/2015","201500773","07/02/2015 09:15","1","HABOURFRONT TERMINAL","HARBOURFRONT TERMINAL","3","1","1","1","9","38","4","1","5","91","67","0","0","0","N","Y","Y","N","N","","23","R","REAR RIGHT SIDE DMG","My bus accidentally hit the concrete barrier behind while reversing in Harbourfront Terminal. No injury. That s all.","","","edsfof02","10/02/2015 15:40","","10/02/2015 15:40","","N"
"E07802015","02","SE","09/02/2015","201500774","07/02/2015 11:44","1","TELAOK BLANGAH ROAD 13.2 KM","TELOK BLANGAH ROAD","3","1","1","1","12","33","3","3","5","70","52","0","0","0","N","Y","Y","N","N","","23","R","NO DMG","I was driving along Telok Blangah Road when another bus (SBS6728X SVC 100) in front of my bus suddenly braked. As a result my bus left mirror touched the rear of SBS6728X. No injury. That s all.","","","edsfof02","09/02/2015 14:55","","09/02/2015 14:55","","N"
"W07542015","02","SW","09/02/2015","201500774","07/02/2015 11:40","4","telok blangah road, B14131","telok blangah road","1","1","1","1","10","42","3","1","5","70","60","0","0","0","N","Y","Y","N","N","","23","R","sbs6728x- rear w/screen dmgd, SGRG, cctv     sbs8788J,svc145","Aft pax act at said bstop a SBS bus hit me in the rear as I prepare to exit from said bstop. no inj. that is all","","","wdssof01","09/02/2015 10:19","","09/02/2015 10:19","","N"
"W07772015","02","SW","09/02/2015","201500775","07/02/2015 12:20","1","tiong bharu Rd T jln membina","tiong bharu road","1","1","1","1","2","25","2","3","1","70","54","0","0","0","N","Y","Y","N","N","","23","R","sbs6052L - front RHS v/m damaged, BMRG, cctv","I was driving alg tiong bharu rd twds Bedok. At said junctn I stopped as red t/light. On my RHS a lorry approached. When it wanted to turn right into Jln Membina its LHS v/m grazed my RHS v/m causing it to bend. It proceed to turn and stoppedahead. Particulars exchanged. OCC informed. All pax alighted. CRS activated. I then RTD back to BBBP. No inj that is all","","","wdssof01","09/02/2015 14:28","","09/02/2015 14:28","","N"
"E07712015","02","SE","09/02/2015","201500776","07/02/2015 12:35","1","Aft Lrg 1 Geylang","Geylang Rd","3","1","1","1","8","42","2","1","5","70","52","0","0","0","N","Y","Y","N","Y","NP299","23","R","SBS6741G, Left v/mirror cover detached","I was driving bus svc 32 along Geylang Rd. I stopped at the b/stop after Lrg 1 Geylang along Geylang Rd to pick up a few pax. As I was about to move off the SBS in front of mine (SBS6739P svc 100) jam braked and I follow suits. However my bus leftv/mirror had slightly grazed the rear of the said bus. Due to me jamming the brakes one of my pax an elderly who had just board the bus fell on the buttocks. I immediately came out to help an elderly and offered to call for the ambulance. Howevershe told me that there was no need for the ambulance to be called and she told me that she was ok. She does not have any visible injuries on her as such some other pax and I helped her up to the seat. I have advise the pax to stay in the cabinas my bus is not continuning the svc I had to the open the doors","","","amoppr10","09/02/2015 13:47","","09/02/2015 13:47","","N"
"W07702015","02","SW","09/02/2015","201500776","07/02/2015 12:37","1","sims ave lor 1 geylang, B80051","Sims Ave","1","1","1","1","13","42","3","2","5","70","60","0","0","0","N","Y","Y","N","N","","23","R","sbs6739P- rear w/screen dmgd, SGRG, cctv         sbs6741G,svc32","I was performing pax act at said bstop when a SBS6741G svc32 hit me in the rear causing damage. No inj. that is all","","","wdssof01","09/02/2015 13:44","","09/02/2015 13:44","","N"
"W07562015","02","SW","09/02/2015","201500777","07/02/2015 15:55","2","Boon Lay Interchange","Driveway","1","1","1","1","3","37","4","1","5","91","70","0","0","0","N","Y","N","N","N","","23","R","SBS9541Y - Rear right body dented ( BLRG )","When I arr at BLI I noticed there was no empty parking lot at svc 249. Aft alighting pax at the end-on-berth parking lot I then reversed my bus to park at svc 249 lot. Due to during reversing my bus at the rear right portion was too closed to thethe concrete wall. I stopped my bus & alighted to check. I then reported to stby mechanic. ARM asked me to swap another bus to go on svc.","","","jradaa01","09/02/2015 10:50","","09/02/2015 10:50","","N"
